id,type,text1,text2,text3,text4,notes
planet_aka_mainyu,CUSTOM,"Tidally locked to its primary, the hot gas giant Aka Mainyu's day side is an eternal hellish maelstrom with winds of vaporized metals reaching speeds of thousands of kilometers per hour. A half million tonnes of ionized gas is blasted from the atmosphere each second creating a complex whorled magnetotail with detectable effects across the entire inner volume of the Duzahk system. ",,,,
toxic_cold,PLANET,"A frozen world enveloped by a thick nitrogen smog dappled with ethane and methane clouds. The surface is formed of eroded water-ice, windswept dunes of organic compounds, and hydrocarbon seas. Liquid water erupts bubbling with methane from cryovolcanoes driven by tidal heating and decaying radioactive elements deep within the mantle.",,,,
slipstream,TERRAIN,"A flow in hyperspace, akin to currents navigated by ancient seafarers back on Old Earth.",,,,
nebula,TERRAIN,"Interstellar clouds of hydrogen, helium, and dust that cause significant sensor noise that may aid a fleet hiding within. The (relatively) thick medium also interferes with drive field operation.",,,,
event_horizon,TERRAIN,The gravitational flux near the event horizon of a black hole is extreme.,,,,
pulsar_beam,TERRAIN,"A relativistic, magnetized jet combined with intense radiation. Commonly emitted by neutron stars.",,,,
corona,TERRAIN,A halo of high temperature plasma which surrounds a star; most ships are not built to withstand prolonged exposure to the extreme radiation bombardment from the corona and will take damage if they remain within it.,,,,
corona_aka_mainyu,TERRAIN,A storm of high energy ions and exceptionally strong magnetic fluctuations. Most ships are not built to withstand prolonged exposure to such extreme radiation bombardment and will take damage if they remain within it.,,,,
asteroid_belt,TERRAIN,An orbital zone abundant with asteroids.,,,,
ring,TERRAIN,"A dense disc of dust or ice which causes a great deal of sensor noise, aiding a fleet hiding within. The medium is not of sufficient density to meaningfully slow down ships.",,,,
debris_field,TERRAIN,"Debris left behind after a battle, a salvaging operation, or simply drifting together at a gravitationally stable location.",,,,
asteroid_field,TERRAIN,A volume of space abundant with asteroids.,,,,
magnetic_field,TERRAIN,A strong magnetic field which traps high energy charged particles. It's extremely difficult to get any sensor readings on a fleet lurking within.,,,,
hyperspace_normal,TERRAIN,This topologically exotic medium of not-quite space-time is used by starships to side-step the speed of light for interstellar travel.,,,,
hyperspace_deep,TERRAIN,"This volume of hyperspace is particularly chaotic, hindering performance of even hyperspace-calibrated equipment.",,,,
hyperspace_storm,TERRAIN,"This volume of hyperspace is undergoing chaotic phase shifts leading to wildly fluctuating resonance cascades. Ancient and dire warnings of prolonged exposure to so-called ""hyperspace storms"" have been passed down through generations of spacers.",,,,
stellar_mirror,CUSTOM,An ultra-light orbital mirror array used to reflect and concentrate solar energy. Stellar mirrors are a common terraforming tool and the art of their use was brought to apogee by the Eridani-Utopia Terraforming corporation during the golden age of the Domain's expansion phase.,,,,
stellar_shade,CUSTOM,An ultra-light orbital shade array used to deflect and collect solar energy. Stellar shades are a common terraforming tool and the art of their use was brought to apogee by the Eridani-Utopia Terraforming corporation during the golden age of the Domain's expansion phase.,,,,
hyperspace_wavefront,TERRAIN,TODO,,,,
kite,SHIP,"A familiar civilian design, the ""Kite""-class aeroshuttle is the day-to-day reminder of Fabrique Orbitale's reputation for aeronautical engineering- a valuable specialty even in the age of space travel. This compact space/aircraft is streamlined for efficient atmospheric flight and boasts a grid of cleverly distributed short-burst maneuvering thrusters coordinated by a delta-level AI subsystem to ensure smooth landings (a point driven home by Fabrique marketing by way of amusing ad-holos featuring a well-dressed couple and an overfull wine glass). The Kite has powerful engines for a civilian ship of its size, though zero-G maneuverability leaves something to be desired when the special subsystem is not engaged.

In the dangerous cycles post-Collapse, the Kite has been outfitted with a defense turret in place of the executive-class viewing dome and the two auxiliary jet-pods are replaced with missile systems (which do not need to draw on the limited powerplant). It won't stand up in a fair fight, but the Kite can be given unexpectedly sharp teeth and use its speed to escape from raiders. Luddic Path radicals have even been known to use modified Kite to deliver strike weapons against helpless freighters, followed by engaging the maneuvering subsystem to make a swift exit to avoid the wrath of their victim's escort.",F,,,
gryphon,SHIP,"The Gryphon is a dedicated missile cruiser designed to provide a highly mobile platform for heavy fire support. It is not a front-line cruiser, and so operates best when provided with escorts.

Among the so-called ""Cruiser School"" wave of ships designed by Altair Exotech, the Gryphon was a key component of the power-projection strategy that came into vogue shortly before the collapse of the Gate system. The Gryphon was meant to allow a task force commander to rapidly concentrate bursts of specialized heavy firepower, forming a devastating hammer to the anvil of assault-class cruisers and destroyers. So reads the Domain-era tactical manual, anyway.

Of particular interest is the Gryphon's hull-integrated missile nanoforge: this fixed architecture nanoforge system allows extremely rapid conversion of densely packed, pre-formulated feedstock into a narrow range of munitions in the midst of battle. This allows the Gryphon to effectively convert concentrated mass into desired armaments, allowing for mid-battle replenishment of missile stocks. The flux output of this process is, of course, tremendous so it is not advisable for captains who are relying on their shields to block enemy fire to engage the integrated missile nanoforge system.",,,,
hammer,WEAPON,"This dumb-fire rocket was ubiquitous in the Sector pre-Collapse due to civilian applications discovered by asteroid miners. The go-to strike weapon of the desperately under-equipped, the Hammer is most often employed by poor independent militias, Pirates, and especially the Luddic Path. This has led to the mildly blasphemous alternative name for the weapon, ""Ludd's Hammer"".",,,,
hammer_single,WEAPON,"This dumb-fire rocket was ubiquitous in the Sector pre-Collapse due to civilian applications discovered by asteroid miners. The go-to strike weapon of the desperately under-equipped, the Hammer is most often employed by poor independent militias, Pirates, and especially the Luddic Path. This has led to the mildly blasphemous alternative name for the weapon, ""Ludd's Hammer"".",,,,
hammerrack,WEAPON,"This dumb-fire rocket was ubiquitous in the Sector pre-Collapse due to civilian applications discovered by asteroid miners. The go-to strike weapon of the desperately under-equipped, the Hammer is most often employed by poor independent militias, Pirates, and especially the Luddic Path. This has led to the mildly blasphemous alternative name for the weapon, ""Ludd's Hammer"".

The Hammer Barrage mount provides a stirring example of the expediency of quantity.",,,,
squall,WEAPON,"Medium-range anti-shield missiles intended to be used in the opening round of a combat encounter to disable the shields of an unwary opponent, opening up an opportunity for high-damage anti-armour projectiles to be deployed in the immediate aftermath of the Squall salvo.

Interchangeable missile pods were designed to allow for ease of rapid reloading of the impressive 20-shot Squall salvo, but the high mass of the pods and finicky mechanicals of the missile autoloaders make the process unwieldy and the timing falls somewhat below the original Domain Armada specifications. Nonetheless, the Squall is a terrifying weapon system when deployed against shield-reliant combatants as it forces a captain with insufficient point defense system to deactivate their shields or submit to high shield flux which may lead to overload. ",,,,
locust,WEAPON,"A large, short range guided missile system designed to launch large numbers of projectiles to overwhelm and cripple enemy fighter squadrons in a single salvo. The Locust can be used against larger targets, but will have little relative effect unless shields and armour are already breached.

The Locust launches bursts of twenty small missiles per salvo. Robust, low-power individual tracking systems are coordinated by a distributed swarm intelligence system to enable excellent tracking of targets, while chemical microthrusters provide maneuverability for a short time. Tried and true targeting algorithms based on the old standby Swarmer missile systems allow Locusts to miss only rarely. The Locust has rightly earned a place in the nightmares of fighter pilots.",,,,
forgevats,SHIP_SYSTEM,A fixed architecture nanforge system which allows rapid conversion of pre-formulated feedstock into missile ammunition during battle. The flux output of this process is tremendous so it is not advisable to engage the integrated missile nanoforge system while taking fire.,Special,Replenishes missile ammunition when used. Generates flux when used.,,
starliner,SHIP,"A passenger liner from a more civilized age, the Mbaye-Gogol 440 ""Starliner"" was built to travel between the systems of the Domain in speed and comfort. The Starliner features private first-class cabins, two classes of food service, a zero-G theatre, and even a small landing/launch bay for exclusive use by executive-class passengers. (Being a civilian ship there are, of course, no facilities for fighter repair and rearmament).

The Starliner is equipped with a forward shield to ensure passenger safety and protect the hull from routine abrasion. Refitted for the current realities of the Sector, this ship class is routinely equipped with all-band anti-missile flare launchers as well as a number of gun turrets; this serves not only to evoke a sense of adventure, but discourage casual piracy while justifying a ""munitions surcharge"" on each ticket sale.",,,,
nebula,SHIP,"The voluminous but ungainly hull of the Mbaye-Gogol 430 ""Nebula"" does little to enhance the romance of interstellar travel but it does ensure a respectable passenger and cargo capacity for a ship of its class. Indeed, the Nebula has slowly come to dominate mid-tier passenger service since the muted reception of its first line of production.

The Nebula is equipped with a forward-facing shield to enhance the safety of passengers and extend the hull plating's maintenance schedule. And the Sector being what it is, several ballistic turrets and anti-missile all-band flare launchers have been mounted at fortuitous locations to assure paying passengers that their well-being is a top priority of the operator.",,,,
mudskipper,SHIP,"Most commonly used as interplanetary ferry, the Mudskipper is indeed interstellar-capable. The ship has no built-in shield generator so must rely on its durable - for a civilian craft - armour to protect passengers and cargo. There is little hope for the Mudskipper in combat, but it is generally equipped with a rear-facing turret to foil attacks by the ever-popular Salamander missile.

The MGA-220 was first produced as the ""Pegasus""-class but was soon anointed with the altogether more humble name ""Mudskipper"". This tough little ship has been a mainstay in backwater civilian transport for centuries, and although not pretty, the rugged construction simplifies maintenance and generous bay doors allow for great versatility. To this point, the Mudskipper's image in the public mind was cemented by a somewhat unlikely holovid sequence featuring a Mudskipper transporting a herd of bovids to a picturesque arid-terraform.",,,,
scarab,SHIP,"The Scarab is a rare, experimental hull developed by the Tri-Tachyon corporation. Only a limited run of prototypes has been produced.

Gross causality violating technology was banned by the Domain, and this ban is now upheld by Hegemony doctrine - with Luddic support. Nonetheless, it is the handful of fringe-examples of this technology which form the foundation for interstellar human civilization from the old Gate system (depending on one's theory of its operation) to common FTL hyperspace travel and communication. Tri-Tachyon has always pushed the bleeding edge of these technologies - and of the law - by spearheading development of phase technology. The Scarab's uniquely hull-integrated prototype ""Temporal Shell"" system is no exception. 

So it is not so much that the Scarab manipulates time as it avoids the normal rate of consequence of the local frame of reference. The effect, as upsetting to Luddic theologians as it is to laymen, is to seemingly slow time for the outside world. Of course one must avoid stating it thus in earshot of the applied temporal physicists who deal in such miracles to avoid a tedious correction of terminology. ",,,,
centurion,SHIP,"A solid heavy combat frigate, the Centurion can be counted upon to fill and hold gaps in the line of battle, as per the Domain-era doctrine practiced by the successor-state of the XIV Battlegroup.

The Centurion is valued for its versatility due to an abundance of hybrid weapon slots and an integrated Damper Field that allows it to shrug off the fearsome firepower it is sure to face in combat.",,,,
wayfarer,SHIP,"With respectable armour and armament for a heavy frigate, the Wayfarer does not cut close the ruthless economy that would suit it for bulk trade on the dedicated lanes where safety is guaranteed by civilized locale (or, at least, an armed escort). No, the Wayfarer is a starship for the lonely runs on the frontier, between worlds where the tough law of necessity reigns, where brigands roam, and the crossed arcs of one's own gun turrets are the best comfort to be found in the cold reach of space. ",,,,
ionpulser,WEAPON,"Built for improved firepower, this enhanced version of the Ion Cannon delivers an electromagnetic pulse (EMP) which can quickly disable enemy systems and engines, dealing heavy damage and arcing to modules near the points of impact.

The Ion Pulser's nonstandard gain medium projects highly-ionized baryonic matter in a coherent bolt via one of three rotating linear accelerator apparati. When the ion bolt impacts the target it creates a localized magnetic field which plays havoc with all manner of electronics, including sensors, fuel igniters, targeting modules, computers, etc. The weapon also fuses certain circuits, and can mildly strain shield generators, thus it does negligible amount of permanent damage. Rarely the only weapon type fitted on ships.",,,,
ionbeam,WEAPON,"A long-range support weapon, the Ion Beam is able to fire more and more disruptive EMP arcs through shields as the target's hard flux levels go up - at a hefty flux cost for the firing ship.

After delivery of the Ion Pulser to the Chernabog Proving Grounds, firing tests and tactical simulations concluded that the weapon system was unsuitable for the role described in the original bid won by Bhilai Exospace. A heavy penalty was deducted from the delivery fee and engineers sent back to produce a charged energy weapon with sufficient range to be mounted on combat platforms expected to be placed behind rather than on the front line of combat. Six months later, they delivered the Ion Beam.

The long range Ion Beam employs a cutting-edge gain pattern best understood as a form of diffracted geometry projected into normal space. Difficult to manufacture, this unique construction nonetheless enables long-range projection of highly-ionized baryonic matter in a coherent beam known to play havoc with all manner of electronics, including sensors, fuel igniters, targeting modules, computers, etc., though it does negligible permanent damage. Operated against a high-flux target, the Ion Beam may occasionally build up a charge that will arc past energy shields entirely as the buildup of charged particles interferes with the shield diffusion cycle.",,,,
mora,SHIP,"This class of carrier was commissioned during the same period of carrier-centric Domain naval doctrine as the ubiquitous Talon fighter. Armoured to withstand the fury of battle alongside the Onslaught, the Mora was nonetheless decommissioned en masse as doctrine shifted to favour heavier guns and capital ships flanked by line-cruisers. 

Demilitarized hulls were sold and converted into mobile industrial platforms for use on the frontiers of the Domain. The rugged and eminently adaptable Mora was a common sight in long-range surveying, mining, construction, drone handling, and use as mobile drydocks. Some hulls were even half-buried on alien worlds and used as armoured power-stations and workshops to form the core of new settlements.

After the Collapse, Mora hulls were re-militarized almost suspiciously rapidly by factions that did not possess dedicated fleet carriers. Today they are an anvil upon which many an unwary Pirate warlord is broken.",,,,
accretion,TERRAIN,"A river of rock, dust, and gas spirals ever inward toward annihilation.",,,,
planet_gelan,CUSTOM,"A large and relatively massive planet in close orbit of its primary, stellar wind has whisked away lighter elements leaving carbon and sulphur dioxides to dominate the atmosphere. The death-shroud of poisonous gas creates a runaway greenhouse effect which, in addition to the crushing gravity, ensures extremely inhospitable surface conditions.",,,,
planet_mairaath,CUSTOM,"Mairaath was devastated by a coordinated Luddic Path operation in cycle 82 which turned its awesome orbital station-cities into weapons thrown against the fantastically terraformed surface. What remains is a charred and broken world, the carefully nurtured weather patterns of the great Mayasuran terraforming cabal transformed into nightmarish storms that circle the globe, forever stirring the ashes of a murdered world.",,"Even after its apocalyptic ruin, humanity still clings to the surface of Mairaath, huddled in the broken shells of great cities brought low, blasted by unending storms.",,
derelict_probe,CUSTOM,"An example of one of the countless thousands of robot probe ships sent out into the galaxy by the Domain to find new resources to exploit, planets to colonize, and explore the unknown. Some variants are produced by automated motherships. This specimen appears to be inactive; pitted by small impacts, its hull displays iridescence from fearsome radiation scarring. This probe's manufacture could well date to a thousand cycles ago.",,,,
derelict_surveyship,CUSTOM,"An automated survey ship from a long-past wave of Domain exploration. Thousands of ships like this were sent in waves, some independent, others attached to (or manufactured by) similarly automated motherships following the first wave of robot probes. This apparently unresponsive hulk has been ravaged by centuries of exposure to charged particles and high velocity impacts from interstellar dust.",,,,
derelict_mothership,CUSTOM,"One of the legendary survey motherships, the quiet automated workhorse of the Domain exploration and colonization effort. This is in essence a von Neumann probe, as the survey motherships contain autoforge capacity to manufacture a suite of smaller survey ships and the supplies required to perform its ongoing mission. This specimen is burned and battered by its centuries of service to the Domain, a drifting forgotten hulk.",,,,
station_derelict_survey_mothership,SHIP,"One of the legendary survey motherships, the quiet automated workhorse of the Domain exploration and colonization effort. This is in essence a von Neumann probe, as the survey motherships contain autoforge capacity to manufacture a suite of smaller survey ships and the supplies required to perform its ongoing mission. This specimen is burned and battered by its centuries of service to the Domain, a drifting forgotten hulk.",,,,
derelict_gatehauler,CUSTOM,"Massive starships that carry the Gates used to establish near-instantaneous connections between worlds of the Domain. The Gate Haulers would burn across space for hundreds of cycles to establish full contact with the grand culture and economy of the Domain. In preparation for the possibility of fringe worlds which spurned the Domain, the Gate Haulers were equipped with potent automated defenses.",,,,
derelict_seedship,CUSTOM,"Seeds promising worlds with a suite of lifeforms to kick-start the processes which maintain a Terran environment, from hardy lichens to simple algae up through cryopod drops which release more advanced lifeforms as planetary conditions improve. The seedship will leave the world to gather new materials from small asteroids, manufacture a new terraforming starter kit, and move on to the next target.",,,,
derelict_cryosleeper,CUSTOM,"This is one of the massive vessels of legend which transported millions of human emigrants from the core systems of the Domain out into the great frontiers stretching from the Sagittarius Arm across the Orion Spur. Judging by the weak but stable EM read on the sensors, many of the sleeper caskets remain viable even after so many hundreds of cycles here on the wild shores of the Perseus Arm.",,,,
coronal_tap,CUSTOM,"This class of megastructure once powered the unfathomable industrial might of the Domain, putting the human civilization well toward Kardashev type II status. It is capable of extracting energy on an astronomical scale directly from the linked star. Losing control of an active coronal hypershunt without following proper shut-down procedures can prove disastrous.",,,,
cargo_pods,CUSTOM,"A clutch of cargo pods drifting through space. These may contain valuable goods that can be recovered, or even cryo-frozen crew that can be rescued.",,,,
cryopods,CUSTOM,A clutch of cryopods drifting through space. These likely contain cryo-frozen crew that can be rescued.,,,,
supply_cache,CUSTOM,"A cache of supplies, weapons, or other equipment, drifting and forgotten - until now.",,,,
weapon_cache,CUSTOM,These drifting cargo pods give peculiar readings unique to the spacecraft armaments.,,,,
,,,,,,
,,,,,,
mairaath_station1,CUSTOM,"Destroyed in the attack on Mairaath of Cycle 82, this cold wreckage of the former astropolis remains in orbit in a cloud of its own debris.",,,,
mairaath_station2,CUSTOM,"Formerly one of the three astropoli of Mairaath, this station was rammed by a Prometheus-class fuel carrier and torn from orbit on a trail of fusion fire and radioactive dust. It has since been taken over by scavengers and made into a pirate haven. The structure still comes up alarmingly hot on radiation scans, but the refugees, desperates, and bandits who call this station home have more timely concerns.",,,,
planet_mazalot,CUSTOM,"Civic centre of the Zagan system, Mazalot is nonetheless a poor and unstable polity known for a series of authoritarian governments that alternately pander to and oppress the majority Luddic population. The planet itself is a story of successful terraforming, albeit water poor. Emplacing and sustaining orbital infrastructure is inconvenient due to an exceptionally strong magnetic field, which has done little to stabilize the independent-minded populace.",,"Although a locus of population in the Zagan system, and indeed demographically significant in the Sector as a whole, Mazalot is a weak link among the worlds of the Persean League, often the site of coups and proxy-wars. Occasionally a benevolent regime comes to power but it is just as soon thrown down by some outside force in the long game between the League and other major factions.",,
planet_yesod,CUSTOM,"This cold, quiet world of stony plateaus riven by sleeping glaciers has been fortified by the Persean League to protect its AM-fuel facility. Fuel production was never brought to full capacity however due to lack of capital investment post-Collapse. A policy of free trade was instituted to appease civilian suppliers despite objections by whatever the latest government of Mazalot happens to be.",,,,
planet_ilm,CUSTOM,"No matter who rules Mazalot, there is money to be made on Ilm in the factories and in the ice-fields whose exports feed capital into this poor system. The youth of Mazalot come here to work, and to send their paychecks home, and many stray from the path of Ludd. In spite of this, Ilm manages to avoid purges and war because no matter who rules on Mazalot, there is money to be made on the independent world of Ilm.",,,,
planet_salamanca,CUSTOM,"A thick nitrogen smog rains hydrocarbons on withered mountains of water-ice that stud Salamanca. At their feet, the stained hab domes disperse armoured workers herding robot-drones which maintain the organics extractors and refineries. All industry here is ruled - from behind appropriate fronts - by an ousted Mazalotian regime/criminal cartel.",,"What began as a megacorp-backed resource-extraction settlement was forcefully overthrown by a small fleet loyal to a regime ousted from Mazalot. They have sought to regain legitimacy by re-entering the Persean League, but are deeply connected to criminal networks and mistrusted even - especially - amongst their League allies.",,
