id,type,text1,text2,text3,text4,notes
more_info,ACTION_TOOLTIP,Show detailed information about the selected entity.,More Info,,,
remove_waypoint,ACTION_TOOLTIP,Remove the currently selected waypoint and related assignments.,Remove Waypoint,,,
recon,ACTION_TOOLTIP,Order a frigate or a fighter wing to scout the waypoint.,Recon,,,
full_escort,ACTION_TOOLTIP,"Order up to 4 frigates, 2 destroyers, or a cruiser and some lighter craft  to escort the target, depending on what ships are available.

Only ships that are capable of keeping up with the target are assigned.",Heavy Escort,,,
light_escort,ACTION_TOOLTIP,"Order a single frigate to escort the target.

Only ships that are capable of keeping up with the target are assigned.",Light Escort,,,
destroyer_escort,ACTION_TOOLTIP,"Order a pair of frigates or a destroyer to escort the target.

Only ships that are capable of keeping up with the target are assigned.",Medium Escort,,,
repair_and_refit,ACTION_TOOLTIP,"Order this fighter wing to go back to the nearest carrier for repairs.

Destroyed fighters will be replaced and the weapons of all fighters will be reloaded.",Repair & Refit,,,
search_and_destroy,ACTION_TOOLTIP,"Order the selected ship to engage enemy targets at its discretion, instead of being assigned to specific tasks.",Search & Destroy,,,
retreat,ACTION_TOOLTIP,Order the selected ship to retreat from battle while defending itself.,Retreat,,,
direct_retreat,ACTION_TOOLTIP,Order the selected ship to retreat from battle at best speed.,Direct Retreat,,,
transfer_command,ACTION_TOOLTIP,"Transfer yourself and your staff to another ship.

You'll be able to take control of it once the command shuttle reaches its destination.",Transfer Command,,,
strike,ACTION_TOOLTIP,"Order fighters to attack this ship. Carriers assigned to this task will send their fighters to attack it and will attempt to stay within fighter range, but will otherwise maneuver and choose their own non-fighter targets independently.

Other types of ships given this assignment will try to attack the targeted ship regardless of the tactical situation, exposing themselves to greater risk, as if given the ""Eliminate"" command.",Fighter Strike,,,
harass,ACTION_TOOLTIP,Order a single frigate to harass this ship while staying out of its weapon range.,Harass,,,
intercept,ACTION_TOOLTIP,"Order your fleet to launch a dedicated attack on this ship. Ships given this assignment will try to attack the targeted ship regardless of the tactical situation, exposing themselves to greater risk.",Eliminate,,,
target,ACTION_TOOLTIP,Target the selected enemy ship or fighter wing leader.,Set as Target,,,
assign_task,ACTION_TOOLTIP,Override the chain of command to personally give one of your ships or fighter wings a specific assignment.,Assign Task...,,,
rescind,ACTION_TOOLTIP,Countermand the selected ship or fighter wing's direct orders and let it be assigned to tasks automatically.,Rescind Orders,,,
cancel_assignment,ACTION_TOOLTIP,"Cancel the selected assignment. Ships and fighter wings currently carrying it out will be automatically reassigned to other duties.

If the selection is a waypoint, it will also be removed.",Cancel Assignment,,,
autopilot,ACTION_TOOLTIP,"Enable autopilot. Your flagship will navigate and fight automatically and will be assigned tasks as appropriate, along with the rest of your fleet.",Toggle Autopilot,,,
,,,,,,
,,,,,,
,,,,,,
asteroid,ASTEROID,"A pitted chunk of metal, ice, or rock hurtling through space. Mainly significant for being a navigational hazard.",,,,
,,,,,,
gas_giant,PLANET,"Primarily composed of hydrogen and helium gases. The temperature and pressure at the core are extreme, but not enough to sustain the deuterium fusion that would turn the planet into a brown dwarf star.",,,,
ice_giant,PLANET,"A giant planet composed primarily of water, ammonia and methane. Within the depths, gravity generates enough pressure to form a core of metallic hydrogen.",,,,
lava,PLANET,"A geologically unstable planet without a permanently formed crust. Glowing fissures and active volcanoes litter the surface, the magma they spew forth combining to form flows that travel hundreds of kilometers across the charred surface.",,,,
frozen,PLANET,"Water or ammonia ice is the primary surface feature of this world. Below the surface, there may be a liquid ocean or a rocky crust.",,,,
barren,PLANET,Radiation from the nearby star ravages the surface of this world due to the lack of an atmospheric ozone layer. No significant geological activity. No indigenous life forms.,,,,
toxic,PLANET,"Carbon and sulphur dioxide gases dominate the atmosphere of this world, making it toxic to all known life. In addition, the gases create a runaway greenhouse effect that increases surface temperature and atmospheric pressures to extremely high levels.",,,,
jungle,PLANET,"A lush and verdant biosphere sits on the surface of this water-rich world. Warm air and water currents permeate the planet's biosphere, leading to perfect conditions for flora and fauna at all latitudes.",,,,
terran,PLANET,"A geologically stable world with a nitrogen-oxygen atmosphere, a magnetic field and ample amounts of liquid water. The axis of rotation creates mild seasons. This type of planet is named for the reputed ancestral home of all human beings in the galaxy.",,,,
terran-eccentric,PLANET,A near-terran compatible ecosystem has taken tentative hold on this world despite highly abnormal planetary conditions. That this planet maintains a breathable atmosphere (or near enough) is a testament to the tenacity and adaptability of biological life.,,,,
desert,PLANET,"This planet is dry as bone and swirling with dust, stellar radiation mercilessly beats the surface. The life-sustaining water of this world has dissipated over the aeons due to a weak magnetic field.",,,,
desert1,PLANET,"This planet is dry as bone and swirling with dust, stellar radiation mercilessly beats the surface. The life-sustaining water of this world has dissipated over the aeons due to a weak magnetic field.",,,,
barren-desert,PLANET,"A deathly dry world, the surface exhibits the warm hue of oxidized iron compounds. A thin atmosphere prevails on worlds of this class, the predominant carbon dioxide stirred occasionally into planet-wide dust storms. Icecaps of atmospheric CO2 may form and sublime with the turn of the seasons.",,,,
arid,PLANET,"An inhospitable, dry world that has a much smaller percentage of water in its atmosphere than the terran standard. Nonetheless, an atmosphere and magnetic field protect the surface from stellar radiation permitting a small biosphere to slowly eke out an existence here.",,,,
tundra,PLANET,"A terran-extreme variant world with a nitrogen-oxygen atmosphere maintained by a relatively subdued biosphere that exists largely within the oceans that undergo periodic thaw periods. The surface is very cold indeed, but it is human-viable if precautions are observed. Carbon dioxide may freeze out of the atmosphere at the poles during the local winter.",,,,
cryovolcanic,PLANET,"A frozen wasteland covered with volcanoes that erupt ammonia or more rarely, water instead of magma.",,,,
rocky_metallic,PLANET,"A rocky-metallic husk-world, its shattered landscape is a record of a violent history. Kilometers-deep chasms rive the surface and craters pit lava-fields beneath inert volcanoes that dwarf any of those on Old Earth. Planets like this are valued for mining operations. There is no significant ecology and only trace atmosphere.",,,,
planet_sindria,CUSTOM,"Capital of the Sindrian Diktat and home to millions of citizens living in underground hive-cities. Centuries of mining has wormed through the crust of Sindria while recent autarky programs have fostered a crude base of heavy industry. Vast energies captured by a series of solar arrays launched from subsurface mass drivers are used to power one of the Sectors few AM fuel production facilities where antimatter is created via hellish physics, then trapped in fullerene shells carefully mixed with heavy hydrogens and actinides into the relatively stable fuel pellets on which interstellar civilization relies.",,"This worlds battered crust of cyclopean debris criss-crossed by kilometers-deep pits and chasms is bombarded with intense radiation on the day side, so habitats and industrial facilities must be built deep beneath the surface. The population of Sindria is concentrated in a handful of hive-cities where living conditions for most are poor and civil law harsh. A desperate underclass lives beneath those who are lucky enough to have found positions in the state bureaucracy and intelligence services. Infrastructure has never kept up with the population crisis of massive refugee immigration during the Askonia Crisis as resources have been concentrated on industry and military power.",,
planet_salus,CUSTOM,"A gas giant world of immense mass, the crushingly-deep atmosphere is coloured by abundant ammonia and sulphide compounds. Vast electrical storms can sometimes be seen on the night-side of this world. Salus is somewhat smaller and has relatively sedate radiation fields compared to those of Jupiter of Old Earth's system.",,,,
rocky_unstable,PLANET,"An unstable world rocked by quakes and eruptions. Where the surface is not covered by seas of cooled lava, it is dominated by rough peaks and scattered supervolcanoes which eject toxic gases to form a tenuous and corrosive atmosphere. This is not a place welcoming to any kind of permanent settlement.",,,,
planet_cruor,CUSTOM,"Cruor will always be a backwater due to its protean surface, broken and re-broken by the tidal forces of Salus. Under Diktat rule, Cruor is a world of temporary mining and prison operations. The free population is made of contractors and technicians from Volturn seeking their fortune off-world. Desperately bored workers burn their wages by partaking of the myriad vices provided by a lively black market quietly tolerated by the Diktat governor. ",,"The world's crust is squeezed and cracked by the powerful tidal forces of Salus, causing regular quakes and eruptions. Abundant geysers of volatile gases maintain a thin, toxic atmosphere and combine with iron compounds to give Cruor its sanguine colouration. Tracked rigs roam the more stable surface provinces, ripping out rare or merely convenient ores for export while corroding ruins of machines can occasionally be seen amidst the scars of strip-mining. Dark rumours circulate about the conditions of mobile labour camps operated by Diktat Intelligence.",,
water,PLANET,A primitive atmosphere covers a world-ocean hundreds of kilometers deep. Its waters teem with primitive life and vast algae-analog mats can be seen by instruments from space. A core of water-ice over a rocky mantle is created by the terrific pressure of the sea.,,,,
planet_volturn,CUSTOM,Volturn possesses a thick atmosphere over a world-sea which has been seeded with re-engineered Terra-type life forms that have largely displaced the relatively primitive native organisms which once formed vast drifting colonial mats. Beneath kilometers of ocean a layer of extreme-pressure water ice lays over a rocky-metallic core. Volturn's population lives in a diverse range of floating habitats and subsists largely on farming and processing complex organic compounds.,,"Volturn was envisioned as a planet of agriculture and leisure to service the now annihilated capital city-moon, Opis. Refugees from the Askonia Crisis have swelled the population of Volturn many-fold, surpassing even the numbers of Sindria and filling the floating arcologies, resort-cruisers, and terraforming barges with makeshift housing. An economy of light industry and aquaculture prevail with many products derived from the processing sea-life that has been genetically modified to flourish in the Volturnian world-ocean. A Diktat garrison maintains uneasy rule over this world of stinking algae farms and sprawling, floating slums that are a hotbed of resistance movements, esoteric cults, and criminal syndicates.",,
rocky_ice,PLANET,"A frozen world of methane and ammonia, water-ice is like rock and may be found in mountainous outcroppings and boulders. A thin atmosphere of volatiles is formed on the starward side of the planet only to freeze again on the dark side. Most craters are filled in over time as this ""snow"" is deposited.",,,,
planet_umbra,CUSTOM,"Seat of the Askonian Revolutionary Council, a local faction of Antis. Conditions are unforgiving as harsh emergency regulations have been decreed by the Council. Economic activity consists of mining volatiles and reprocessing tailings from the abandoned core-boring project. The ARC has also allowed what might be termed ""pirates"" to operate from Umbra, for independent traders have been scared away by the ""emergency expropriations"" imposed by the ARC. Small numbers of refugees came to Umbra, straining local infrastructure, to join the revolution or expecting to find their way elsewhere.",,"Far from Askonia's primary, Umbra is a frozen world of methane and ammonia where water-ice is like rock and may be found in mountainous outcroppings and boulders. A thin atmosphere of volatiles is formed on the starward side of the planet only to freeze again on the dark side. Most craters are filled in over time as this ""snow"" is deposited. There is some mining of heavier materials from the poor, rocky mantle buried many kilometers beneath the glacial crust. Habitats are burrowed deeply; life on Umbra is harsh and few would willingly choose to live here permanently. A trickle of idealistic out-of-system volunteers still brings much-needed supplies and hope.",,
star_yellow,PLANET,"A G2 type primary sequence star, estimated age is five billion years. Surface temperature is only about six thousand degrees, while core temperature could well exceed fifteen million degrees.",,,,
star_orange,PLANET,"Slightly cooler and smaller than Old Earth's sun, this class K star most resembles Alpha Centauri B. It is particularly stable, burning on the lower end of the main sequence for tens of billions of years and thus considered a likely host to life-bearing and terraformable planets.",,,,
star_blue_giant,PLANET,"A very high temperature and luminosity O-type star. Although extraordinarily massive this star is short-lived due to the hellish rate at which it fuses its constituent elements. It will quickly, for a star, explode as a supernova which may briefly outshine entire galaxies before transforming into a black hole or neutron star. The energies unleashed from the star's raging fusion heart erupt in powerful stellar winds that will strip the atmosphere from closely orbiting planets - and the hull from any starships that linger nearby.",,,,
star_blue_supergiant,PLANET,"An O-type star of extreme temperature, luminosity, mass, and volume. The supergiant star is sufficiently massive that it transitions smoothly from burning hydrogen to helium and onward. It is among the brightest candles, burning quickest and brightest before exploding as a supernova which may briefly outshine entire galaxies, bathing entire sectors in deadly radiation. The energies unleashed from the star's raging fusion heart erupt in powerful stellar winds that will strip the atmosphere from closely orbiting planets - and the hull from any starships that linger nearby.",,,,
star_browndwarf,PLANET,"This brown dwarf is a sub-stellar primary mass which has not reached sufficient temperature to fuse hydrogen, though it radiates appreciable electromagnetic radiation due to gravitational compression. Smaller brown dwarfs are categorized with massive gas giants on a somewhat muddled spectrum rather than with a definitive threshold. The magnetic fields of the brown dwarf are powerful and potentially tumultuous compared to small planets.",,,,
star_neutron,PLANET,"This is a star that lived, died in nova, and now lives again as an extraordinarily small, hot, dense mass whose volume is maintained by the strong nuclear force rather than rote electromagnetism. Although massing up to three Solar masses, the neutron star's radius is equivalent to barely that of Old Earth. Rapidly spinning neutron stars may emit intense beams of electromagnetic radiation; these are known as pulsars. A wise starship captain would do well to avoid them.  ",,,,
black_hole,PLANET,"The result of the apocalyptic collapse of a massive star. No object can escape from the black hole, nor light itself. The black hole does however emit detectable Hawking radiation due to poorly-understood quantum effects. No information can be detected beyond the event horizon with any device known to exist in the Sector. The intense gravity of the black hole rips and tears nearby objects into an accretion disc which inevitably spirals into the gravitational abyss. Extremely dangerous.",,,,
star_orange_giant,PLANET,"A giant class K star which has depleted its hydrogen fuel and has reached sufficient temperature, due to sufficient mass, to fuse helium. Technically a kind of red giant, this star is more massive and hotter-burning than more common examples. Resembles the star Aldebaran known to classical pre-Domain astronomy.",,,,
star_red_supergiant,PLANET,"A supergiant star in a late phase of its mayfly-short stellar life, this class M star has the largest volume of all known stellar types. It has exhausted its core's supply of hydrogen, transitioning smoothly to the fusion of helium, and is likely to proceed onward through the elements up to iron before creating a supernova. Although extraordinarily massive, the outer envelope of the star is extremely sparse and has a relatively low temperature, providing its characteristic hue. This star is casting off its constituent matter at a rapid rate and will form a spectacular nebula. Betelgeuse and Antares are examples of red supergiants known to classical pre-Domain astronomy.",,,,
star_red_giant,PLANET,"A low-to-medium mass star in a late phase of stellar evolution, a red giant has exhausted the supply of hydrogen in its core and switched to hydrogen fusion in a shell around the now-helium core instead. While the star itself is huge, the outer envelope has a lower temperature, giving the star its characteristic hue.",,,,
star_red_dwarf,PLANET,"A class M main sequence star, small and exceedingly common. These relatively cool stars often mass only a fraction of Old Earth's sun. ",,,,
star_white,PLANET,"The beginning of the end for most stars, the white dwarf was once a red giant not massive enough to fuse carbon. Extremely dense and slowly radiating away its heat as it no longer undergoes fusion reactions, its volume is supported against gravitational collapse only by electron degeneracy pressure. ",,,,
entropyamplifier,SHIP_SYSTEM,"Temporarily increases the damage taken by the target ship. Generates a significant amount of flux when used.

The duration of the effect is in the reference frame of the source ship; if it phases or otherwise experiences an altered time rate, the duration of the effect will be likewise affected for outside observers.",Offensive,Increases the damage taken by the target ship. Generates a significant amount of flux when used.,,
interdictor,SHIP_SYSTEM,"Interferes with the target ship's drive field, disabling some engines.

Generally does not cause a flameout when used against a ship with its engines fully operational, but may do so depending on the engine configuration, as it will always knock out at least one active engine.",Offensive,"Interferes with the target ship's drive field, disabling some engines.",,
mine_strike,SHIP_SYSTEM,Teleports a heavy phase mine to the target area. The mine will slowly track nearby enemy ships and explodes a few seconds after its proximity trigger is activated. Can be used while phased.,Offensive,Teleports a heavy proximity mine to the target area. Can be used while phased.,,
mote_control,SHIP_SYSTEM,Energy motes deal heavy EMP damage to ships and obliterate fighters and missiles. Using the system creates a temporary attractor point for the motes. The motes automatically target nearby missiles and fighters unless an attractor point is set on an enemy ship.,Special,Energy motes deal heavy EMP damage to ships and obliterate fighters and missiles.,,
acausaldisruptor,SHIP_SYSTEM,"Briefly overloads a nearby enemy ship.

Exploits weakly acausal principles poorly understood even before the Collapse. In the present day, the effects may as well be magic.",Offensive,Briefly overloads a nearby enemy ship.,,
temporalshell,SHIP_SYSTEM,"Speeds up the flow of time on board the ship. Generates a significant amount of flux when used.

Research on prolonged exposure to the effect was described as 'worrying' and quietly halted.",Special,Speeds up the flow of time on board the ship. Generates a significant amount of flux when used.,,
damper,SHIP_SYSTEM,Briefly activates an energy field that mitigates incoming damage at the cost of disabling weapons and shields.,Defensive,Briefly activates an energy field that mitigates incoming damage at the cost of disabling weapons and shields.,,
damper_omega,SHIP_SYSTEM,"Briefly activates an entropy-dampening field that halves all damage taken and all flux generated, and rapidly repairs all disabled engines and weapons. Disables shields.",Defensive,"Briefly activates an entropy-dampening field that halves all damage taken and all flux generated, and rapidly repairs all disabled engines and weapons. Disables shields.",,
flarelauncher,SHIP_SYSTEM,Launches flares that distract the guidance systems of incoming missiles and PD weapons. Any missile hitting a flare will be destroyed.,Defensive,Launches flares to confuse the guidance systems of nearby enemy missiles.,,
flarelauncher_active,SHIP_SYSTEM,Launches flares that distract the guidance systems of incoming missiles and PD weapons. The flares also track missiles and any missile impacting a flare will be destroyed.,Defensive,Launches flares to confuse the guidance systems of nearby enemy missiles. The flares are fast and actively track the missiles.,,
flarelauncher_fighter,SHIP_SYSTEM,Launches flares that interfere with point-defenses.,Defensive,Launches flares that interfere with point-defenses.,,
flarelauncher_single,SHIP_SYSTEM,Launches flares that interfere with point-defenses.,Defensive,Launches flares that interfere with point-defenses.,,
burndrive,SHIP_SYSTEM,Temporarily engages a primary burn on the system travel drive of the ship. Provides a massive speed boost for a fixed time at the expense of being able to use shields. The ship runs the risk of full engine flameout on any significant collision.,Movement,Provides a massive speed boost at the expense of being unable to turn or use shields. Collisions can cause a flameout while the system is active.,,
maneuveringjets,SHIP_SYSTEM,Engages extra thrusters to greatly improve the ship's maneuverability. Also provides a slight boost to the ship's top speed.,Movement,Provides a brief boost to maneuverability and top speed.,,
plasmajets,SHIP_SYSTEM,"Provides a brief but extreme boost to top speed, along with a slight maneuverability boost.",Movement,"Provides a brief but extreme boost to top speed, along with a slight maneuverability boost.",,
microburn,SHIP_SYSTEM,"Provides a brief engine boost, propelling the ship forward at an extreme velocity.",Movement,"Provides a brief engine boost, propelling the ship forward at an extreme velocity.",,
microburn_omega,SHIP_SYSTEM,"Provides a brief engine boost, propelling the ship forward at an extreme velocity.",Movement,"Provides a brief engine boost, propelling the ship forward at an extreme velocity.",,
fastmissileracks,SHIP_SYSTEM,Additional servos and ordnance conveyors allow the ship to quickly reload missile weapons. Activating the system generates significant flux.,Offensive,Reloads all missile weapons quickly. Generates flux when used.,,
fortressshield,SHIP_SYSTEM,"Redirects all power from the weapon systems to shields, greatly increasing the efficiency at which damage is absorbed. This process generates hard flux at a steady rate even if the shields are not taking any fire.",Defensive,"Reduces the damage taken by shields to a minimum, but generates hard flux while active.",,
highenergyfocus,SHIP_SYSTEM,"Briefly increases the damage dealt by all energy weapons. The capacitor array stores multiple charges, which are slowly regenerated.",Offensive,Briefly increases the damage dealt by all energy weapons.,,
drone_strike,SHIP_SYSTEM,"Supercharges one of the Terminator drones with a brief energy transfer. The drone tracks a nearby target like a missile, dealing massive area damage on impact.",Offensive,"Supercharges one of the Terminator drones and sends it after a target. The drone deals 1200 Energy damage and 600 EMP damage on impact, and charging it generates 600 flux.",1200 Energy | 600 EMP | 600,
canister_flak,SHIP_SYSTEM,Fires a large number of flak canisters with variable-timed proximity fuses all around the ship.,Defensive,Fires a large number of flak canisters with variable-timed proximity fuses all around the ship. Each canister deals 200 High Explosive damage in an area and is targeted to avoid friendly fire.,200 High Explosive,
phaseteleporter,SHIP_SYSTEM,The ship instantly teleports to any desired nearby location. Requires zero-flux boost to use.,Movement,The ship instantly teleports to any desired nearby location. Requires zero-flux boost to use.,,
displacer,SHIP_SYSTEM,Teleports the ship forward in the direction it's traveling. The system slowly builds up to three charges which can then be expended in short order.,Movement,Teleports the ship forward in the direction it's traveling. The system can store up to three charges at once.,,
