id,type,text1,text2,text3,text4,notes
lightmg,WEAPON,"A venerable low-cost, readily available rapid fire weapon which has been used effectively versus missiles and fighters at short range throughout the history of combat in space. It is nearly useless versus properly armored targets.

Due to ease of manufacture, hundreds of models exist in the Sector. Any weapon that employs chemical propellant to fire inert projectiles at over 1200 rounds per minute can be classified as a light ship-mounted machine gun, but beyond that the mechanisms that drive the actions of these weapons vary considerably. 

Popular with small civilian craft due to low cost ammunition. Projectiles jacketed with metals that have a high melting point allow greater muzzle velocity and deliver a surprisingly large amount of kinetic energy at close-range.",,,,
lightdualmg,WEAPON,"An upgraded, twin barrel version of the venerable light machine gun. Not effective against armored targets, but has excelled in an anti-missile and fighter role since the dawn of human space combat.

This is a dual mount of the same rapid fire, inert, low-caliber chemical projectile weapon known to every pilot in the Sector. An excellent point defense mount, which excels in both a missile interdiction and anti-fighter role. 

The large amount of kinetic energy delivered to shield systems of enemy craft at close-range typically causes emitter overload, a tactical option often overlooked by inexperienced captains.",,,,
lightmortar,WEAPON,"An antiquated weapon that fires anti-armor rounds at a low rate of fire, muzzle velocity, and range. Its low flux buildup is a lone saving grace.

The weapon blueprints for Light Mortars actually did not intend them for spacecraft at all, but an ingenious modification to the breech loading mechanism permits installation and use outside an atmospheric environment. In combat, there is little the Light Mortar can do versus moving or shielded targets due to its terrible mount rotation and rate of fire. Nonetheless, it is often used for training novice gunnery officers in the finer points of space ballistic tactics and nomenclature.

Commonly fitted on private yachts and solo interplanetary vehicles because it is so light and cheap.",,,,
heavymortar,WEAPON,"An antiquated weapon that fires larger anti-armor rounds at a somewhat higher rate of fire than its smaller cousin. Projectile speed is low and effective range is short. Low flux buildup is a lone saving grace.

The Heavy Mortar was originally designed for use in planetary surface combat. Ostensibly intended for cracking fortifications, it saw far more use in urban bombardment. The robust internal mechanisms permit installation and use outside an atmospheric environment with only minor adjustments, notably replacement of the automatic rangefinder/targeting module. If employed against a large, unshielded, and slow-moving target, the heavy mortar can prove most effective.",,,,
vulcan,WEAPON,"A rapid fire weapon that is especially devastating to missiles and fighters at point-blank range. Accuracy degrades sharply during prolonged bursts. 

An advanced timing mechanism beats in the heart of this multi-barrel weapon platform, generally manufactured only by licensed Hegemony Autofactories. Rounds typically use depleted uranium tips and are non explosive. Multiple barrels enable an extremely high rate of fire, which comes at a cost in flux.",,,,
lightac,WEAPON,"A small caliber autocannon with a good range for such a light weapon. Designed to weaken enemy shields, especially effective against weaker generators.

The weapon fires high velocity kinetic rounds designed to overload enemy shields with ease. Features an autoloader and is liquid cooled. 

Excellent fire support weapon for smaller craft.  Poor mount turn rate makes it a bad choice vs fighters and missiles.",,,,
lightdualac,WEAPON,"A double barreled version of the Light AC. An excellent weapon for close-range support, and quite effective at bringing shields down, it suffers from a shorter effective range due to high recoil.

An ingeniously elegant mechanical design prevents ejection ports from being jammed while expelling twice as many spent shell casings as the standard chassis. Like the single barrel version, the weapon fires high velocity rounds designed to punch through enemy shields. Autoloader and liquid cooling systems are identical to the single barrel version.",,,,
lightag,WEAPON,"A small caliber cannon designed for close-range fights, excellent versus armor and with a superb fire rate.

Small caliber cannon designed to fire high-explosive rounds. Design of the coolant systems and autoloader emphasizes safety and prevention of cook-off potentially caused by high flux levels. Favored by destroyer captains that have something to prove.",,,,
fragbomb,WEAPON,"Releases a cluster of free-floating bomblets that retain the momentum of the launching craft. The bomblets are equipped with a proximity fuse.

A Frag Bomb projector fires Mark VI fragmentation bomblets from three tubes. Unguided and without a propulsion system, the bomblets rely on a friend-or-foe targeting system. Their vast numbers allow them to cover a wide swath of space, effectively creating a Point Defense barrier in that location, albeit for a limited time. When the proximity fuse is triggered by an enemy craft, the bomblet will detonate, achieving similar effects to those of flak weapons.",,,,
clusterbomb,WEAPON,"Releases a cluster of free-floating, high-explosive bomblets. More effective versus unshielded and slow-moving targets.

A Cluster Bomb projector is equipped with three tubes designed to fire dozens of Mark II Explosively Formed Penetrator bomblets. The bomblets are unguided and have no propulsion system, relying on the initial momentum of the strike craft to engage the target. They are equipped with a friend-or-foe targeting scanner, and will only detonate when impacting an appropriate target. The shaped charge explosive is highly effective versus unshielded targets. The sheer number of bomblets that can be deployed by this weapon system is staggering, and as such it makes the Cluster Bomb a useful area denial weapon.",,,,
bomb,WEAPON,"A tried and tested weapon system, the bomb bay holds multiple warheads that rely on the velocity of the launching craft to reach their target.

Each bomb bay is equipped with several non guided high-explosive Comp-X bombs that can be released one at a time. The bombs have no propulsion system and are dependent on the velocity of the launching craft to carry them to target (i.e., dive bombing).  Atmospheric shielding intrinsic to the design also gives the bombs a high Time To Live in an hostile Point-Defense environment.",,,,
lightneedler,WEAPON,"Fires bursts of small flechettes at a high rate of fire. The volume of fire can quickly overwhelm shield projectors, but is generally ineffective against armor.

A Light Needler is a small-bore flechette gun, designed to fire caseless ammunition. Features an impressive feed system which can deliver hundreds of ""needles"" per second. There is no need for an ejector system, and the resulting space availability is instead used to provide additional cooling units, vastly enhancing the rate of fire. 

Domain Naval doctrine holds that the weapon is to be used on enemy shields at long-range, but in a pinch, gunnery officers will train their Needlers on enemy fighter wings and long-range missile threats.",,,,
railgun,WEAPON,"A high-tech improvement of the Autocannon, the railgun fires accurate, medium-range slugs. Like the AC, it excels at overwhelming enemy shield generators.

A miniaturized version of the Gauss Cannon, the railgun relies on a strong magnetic field to fire shells at high velocities. The accuracy and range are excellent, and the turret is able to rotate quickly while not firing. 

The railgun is preferred to the Autocannon by gunnery officers that have ample flux capacity at their disposal.",,,,
shredder,WEAPON,"A rotatory cannon with generous engineering specifications which provide for great ease of operation and reliability. Weapons officers across the professional navies of the Sector, meanwhile, curse the Thumper for rewarding poor maintenance habits. 

Shreds enemy missiles and fighters with an overwhelming hail of small payload, medium velocity fragmentation rounds. Although flux-efficient, this weapon system has little effect against armor and shields.",,,,
flak,WEAPON,"A defensive weapon system that fires shrapnel-filled shells equipped with a proximity fuse for maximum effect against fighters and missiles.

The rising prominence of small, cheap fighter craft, especially in the strike role, led to a wider deployment of this weapons system in the heady days pre-Collapse. Fires ballistic rounds fitted with a proximity fuse. The resulting explosion sends a hail of flechettes in a wide area with a respectable kill radius versus standard targets. Newer models feature a fire control system hardwired into a Mark VI Predictor.",,,,
heavymg,WEAPON,"A larger cousin of the ubiquitous rapid-fire machine gun category of weapons, the Heavy MG is effective against both small and medium-sized targets.

A workhorse of patrol craft across the Sector, this weapons system features reliable blowback firing mechanism said to date back to the days of Old Earth. Safety features include a positive cook-off safety for open bolt clearing and double ram prevention. The weapon is typically mounted on a relatively heavy base to help absorb recoil during prolonged bursts of fire. Calibers vary within a moderate range and ammunition is easily fabricated by standard forges. 

The heavier projectiles do not shatter upon impact like lighter ammunition and present a credible threat to frigate-class vessels. Extremely accurate, though slower-firing than a vulcan cannon. Excels in a point-defense role.",,,,
arbalest,WEAPON,"An antiquated weapon design with high per-shot damage for its size. The kinetic shells are especially effective versus enemy shields.

Heavier patrol craft at the time of the Collapse were mostly fitted with the Arbalest Mk I weapons platform; this likely explains why the Arbalest is claimed to be among the most scavenged ship weapon systems in the Sector. The primitive cooling system and a lack of an autoejector hamper rate of fire and reliability. 

The only redeeming feature is the ubiquity of blueprints for the arbalest round, which is effective at bringing down enemy shields. The effectiveness of the shells is poorly understood, and is suspected to lie in the unintended electromagnetic properties of the shell jackets.",,,,
dualflak,WEAPON,"An upgraded, viciously effective dual mount of the Flak Cannon. Nicknamed ""The Widowmaker"" for its ability to tear apart incoming fighters.

Just like the standard flak cannon, this weapon devastates smaller fighter and missile targets, firing two proximity fuse fitted rounds. Shaped dispersal ensures dual detonation and a higher kill radius. Fighter craft are rarely launched against ships that are fitted with this weapon system, out of fear of what it can do. Excellent rate of fire and turret turn rate.",,,,
chaingun,WEAPON,"The GA-X Industries Mk. II chaingun excels at close-range fighting, where accuracy is less important than overall damage and volume of fire.

A 'melee' captain's favorite tool, the Assault Chaingun delivers high-explosive shaped charge rounds on target at nearly 400 shells per minute. Features electrically driven feed and ejector systems and an advanced nano cooling unit built right into the barrel. 

The only drawback is a heavier turret profile which, coupled with the lack of the accompanying governor blueprint, is typically mounted on incompatible rotators giving rise to unexpectedly low turret rotation speeds.",,,,
heavymauler,WEAPON,"An advanced weapon system designed to punch through armor plating at long-range. Has a low sustained rate of fire but high per-burst damage.

A brutal weapon, the heavy mauler is designed to engage targets at medium to long-range. At its core, the weapon is an autocannon with a nano-cooling system and an external ejection port. However, unlike normal autocannons, the heavy mauler is distinguished by an antimatter barrel charger fed by trivial amounts of standard starship fuel.

When leaving the firing chamber, each shell ogive is charged with a field of antiprotons which hovers 10-20 nanometers in front of the shell, stabilized by a baryon coating. On impact with a target, this antiproton ""sheath"" loses structural integrity and the resulting reaction does further damage. Given the fact that shells already deliver impressive destructive force to the target, the combined reaction makes the heavy mauler particularly effective versus armored targets.",,,,
heavyac,WEAPON,"A triple-barreled cannon that fires a burst of standardized shells at medium range. It is most effective versus enemy shields.

Medium caliber, triple-barreled autocannon, typically deployed with medium-bore ammunition. Electrically primed firing fuses ensure precise fire counts. A great fire support weapon, it is typically fitted on destroyer and cruiser class ships. A battery of heavy autocannons with a proper firing solution may pose a serious threat to capital ships. 

Additional mass necessity to accommodate the complex autoloader and cooling systems results in a very poor turn rate.",,,,
hveldriver,WEAPON,"A specialized weapon designed to overload and disable enemy systems from afar. The high-velocity duranium slug is also effective against shields.

The hypervelocity driver uses a 2-stage process to accelerate a duranium slug with a magnetized iron-cobalt core to a very high velocity. A chemical charge accelerates the slug first, then the magnetic coils take over, accelerating the slug further and stabilizing its flight. The slug is highly charged by the time it reaches the target, generating a significant amount of electromagnetic interference on the ship it impacts.",,,,
heavyneedler,WEAPON,"A dual-mount of the Light Needler with a heavier base, this advanced weapon system is capable of quickly overwhelming shield projectors.

The Heavy Needler is an advanced weapon that fires small flechette rounds. An improvement upon the Light Needler, it features better feed and cooling systems, which enable an even greater rate of fire. Projectiles are identical to the light version: caseless ammunition tungsten-jacketed flechettes.",,,,
gauss,WEAPON,"A long-range weapon designed to overload the target's shields. The heavy kinetic slug it fires is also effective against all but the heaviest armor.

Uses magnetic coils to accelerate a large ultra-dense composite slug to relativistic speeds. Usually rated at the hundreds of giga-amperes range, rarely exceeding one tera-ampere. Unlike most ballistic weapons, has a very high flux load when fired. Turrets mounted with this system have an extremely poor turn rate. 

Very effective weapon whose usefulness is limited by the low reactor power of ships that typically feature large ballistic weapon mounts. ",,,,
hephag,WEAPON,"A medium-range gun designed to punch through heavy armor. The raw damage output also enables it to overwhelm weaker shield emitters.

A truly devastating weapon platform, named for an archaic god of volcanoes. A typical turret mount features two L/89 barrels that trade off firing armor-destroying rounds at 240 RPM. An electromagnetic ejector, powered feed system and nanocoolants allow the weapon to fire for extended time periods. The shaped charge shells have low muzzle velocity and great armor penetrating power. ",,,,
mark9,WEAPON,"An imposing medium range autocannon, most effective versus shields. Also obliterates unarmored hulls with a large volume of heavy caliber projectiles.

It is known that warships of the early epoch of the Domain lacked contemporary levels of armor protection. A weapon with a name like the Mark IX Autocannon was probably a refinement of the earliest schools of weapons engineering in the Domain. Two barrels combined with a unique double-loader system form the core of the weapon system.

The Mark IX blueprints were first re-discovered in the Sector from a drifting derelict captured in the gravity well of Penelope's Star. After a hasty examination by an unqualified appraiser, the design was declared obsolete. The blueprint was auctioned off to a small mercenary organization known as the Free Star Combine, a militant subsidiary of the Ko Combine, and forgotten. 

Cycles later, the Free Star Combine finally built a prototype and begun weapon trials. The weapon was deemed too huge, difficult to mount in all but the largest craft, mediocre at best versus armored targets, and its range was anything but extraordinary. Nonetheless, the Mark IX stubbornly refused to be explained away by the theorists, as its raw damage output is impressive. These naysayers were quieted even further when secondary trials showed how utterly devastating the Mark IX is to shield generators.

The results of these trials did not remain secret for long, and the availability of the now common blueprints meant that the Mark IX was quickly manufactured to meet the demand in the Sector.",,,,
mjolnir,WEAPON,"A medium range cannon that delivers superior damage over time and also has a significant EMP payload.

A very advanced design, the Mjolnir is technically a magneto-gravitic shell projector, not a standard cannon. The micro capacitors within each shell are able to deliver enough energy to create a small-scale localized singularity. The built-in gravitic lens devastates all nearby matter, and creates the dreaded electromagnetic pulse (EMP) effect, disabling the target's weapons and systems. ",,,,
multineedler,WEAPON,"Fires multitudes of needles in a tight arc, creating a withering hail of projectiles that rip apart anything in their path. 

The Storm Needler is a flechette weapon, which fires caseless small-bore ammunition. Having reached the practical limits of medium sized cooling systems, the designers of caseless weapons blazed a path into the large weapon category with the Storm Needler's advanced nano coolant recyclers, per-barrel magnetized rifling and automated operation. An intelligent autoloader unpacks and loads just the right amount of ammunition from the magazines, allowing for nonstop operation provided adequate flux capacity.

The good range and speed of projectiles put a great strain on enemy shields, and can also be used effectively versus point defense threats.",,,,
hellbore,WEAPON,"A huge cannon which fires slow-moving plasma-charged projectiles. Rounds are highly effective versus armor and obliterate any hull structure left underneath.

A feared weapon platform, rarely deployed due to the complexity involved in manufacturing a built-up barrel that can safely fire enormous high-explosive shaped charge rounds. When such a shell impacts a target, the Neumann effect causes the warhead to propel a jet of molten metal into the target's armor, vaporizing a small area, causing hull breaches, depressurization, and extensive internal damage from the spall.",,,,
reaper,WEAPON,"A single unguided torpedo of devastating yield with a powerful on-board engine.

The quintessential strike weapon, a single Reaper torpedo is a large self-propelled, armored, unguided delivery system for an enriched AM-catalyzed nuclear warhead. The science behind the surprisingly compact detonator is poorly understood in the Sector though widely speculated to be based on physics classified as secret by Domain authority. What is known is that three or four of these slipping through PD arcs are enough to destroy even the largest capital ship.",,,,
atropos,WEAPON,"A rack of advanced guided torpedoes. The payload is smaller than usual to make room for the advanced guidance package and maneuvering system's reaction mass.

The Atropos torpedo is a large guided torpedo with an extended range. Each rack mounts two torpedoes which can be fired separately, allowing strike captains maximum flexibility. The AM-catalyzed nuclear warhead typically used in torpedo warheads is missing here as baryonic interference from the detonator would foul the guidance systems. It is replaced by a smaller, yet still potent chemical charge.",,,,
atropos_single,WEAPON,"A single advanced, guided torpedo. The payload is smaller than usual to make room for the advanced guidance package and maneuvering system's reaction mass.

The Atropos torpedo is a large guided torpedo with an extended range. The AM-catalyzed nuclear warhead typically used in torpedo warheads is missing here as baryonic interference from the detonator would foul the guidance systems. It is replaced by a smaller, yet still potent chemical charge.

This mount features only a single torpedo.",,,,
swarmer,WEAPON,"A short range guided missile launcher. The missiles are designed to intercept and destroy enemy fighters.

Launches bursts of small missiles. A simple infrared system provides effective tracking while chemical microthrusters provide exceptional maneuverability. Evolutionary targeting algorithms honed over centuries of real-world application allow the missiles to lead the target - they rarely miss and are very hard to avoid.",,,,
swarmer_fighter,WEAPON,A short range guided missile launcher. The missiles are designed to intercept and destroy enemy fighters.,,,,
annihilator,WEAPON,"Fires a spread of unguided rockets that cover a wide arc. Typically used to strip away enemy armor once shields are down.

Medium to long-range rockets launched from a small pod that fires five missiles per salvo in a narrow spread to improve the odds of hitting. Rockets are small and unguided, with the extra space being taken up by a larger warhead and improved propulsion systems, as well as thicker armor. 

Performs well against larger targets due to the higher chance of striking with multiple rockets. A rocket attack is often used as a screen before a torpedo strike to reduce the effectiveness of Point Defense systems. Takes several seconds to reload after a salvo.",,,,
annihilator_fighter,WEAPON,Fires a salvo of unguided rockets. Typically used to strip away enemy armor once shields are down.,,,,
annihilatorpod,WEAPON,"Fires a stream of unguided rockets. Useful for dealing with enemy armor, or - due to having no flux cost - applying sustained pressure.

Features the same medium to long-range rockets found on smaller launchers. Rockets are unguided, with the extra space being taken up by a larger warhead and improved propulsion systems, as well as thicker armor. 

Performs well against larger targets due to the higher chance of striking with multiple rockets. A rocket attack is often used as a screen before a torpedo strike to reduce the effectiveness of Point Defense systems. ",,,,
heatseeker,WEAPON,"Homes in on the target's engines and disables them with a powerful EMP burst. A combat-rated autoloader system ensures usefulness in protracted engagements.

The Salamander missile is a specialized weapon with two design considerations. The first is an extremely advanced tracking/targeting mechanism which enables it to home in on enemy engines, whilst avoiding all other potential impact points and Point Defense threats. 

The second is a special warhead design which, instead of attempting to destroy the target with kinetic or explosive force, generates targeted electromagnetic fields of high magnitude. When such a field is created in the proximity of unshielded engines and hull components, it will quickly knock out all their electronics, rendering them useless until repaired.",,,,
salamanderpod,WEAPON,"Homes in on the target's engines and disables them with a powerful EMP burst. A combat-rated autoloader system ensures usefulness in protracted engagements.

An externally mounted pod replaces the more common missile racks and allows two missiles to be fired almost simultaneously. An autoloader extracts, arms and primes the next salvo of two missiles after a short wait.

The Salamander missile is a specialized weapon with two design considerations. The first is an extremely advanced tracking/targeting mechanism which enables it to home in on enemy engines, whilst avoiding all other potential impact points and Point Defense threats. 

The second is a special warhead design which, instead of attempting to destroy the target with kinetic or explosive force, generates targeted electromagnetic fields of high magnitude. When such a field is created in the proximity of unshielded engines and hull components, it will quickly knock out all their electronics, rendering them useless until repaired.",,,,
harpoon,WEAPON,"Medium range, high payload guided missile rack. Devastating against ships with downed shields.

Three-racked medium range missiles. An excellent propulsion system delivers a large warhead to the target at sublight speeds. Sacrificing maneuverability for speed and warhead size, the medium range missile is one of the highest yield non strike weapons employed in the Sector. One hit is almost fatal to frigate-sized ships.

This weapon system features a firing rack that houses multiple missiles.",,,,
harpoonpod,WEAPON,"Medium range, high payload guided missile pod. Devastating against ships with downed shields.

An externally mounted pod replaces the more common missile racks and allows multiple missiles to be fired almost simultaneously. An autoloader extracts, arms and primes the next salvo of missiles after a short wait.

These medium range missiles are identical to the ones fired from single or triple racks, and are a great way to finish off a ship with downed shields. An excellent propulsion system delivers a large warhead to the target at sublight speeds. Sacrificing maneuverability for speed and warhead size, the medium range missile is one of the highest yield non strike weapons employed in the sector. One hit is almost fatal to frigate-sized ships.
",,,,
