id,type,text1,text2,text3,text4,notes
conquest,SHIP,"The Conquest-class battlecruiser is the embodiment of concentrated firepower. Developed in the period just preceding the popularization of fighter craft, the class emphasizes firepower and speed over armor protection.

Space Naval tacticians of the day were confident that new weapons systems would always outperform armor and shields and thus were the key to winning an engagement. So why not build a ship for speed and power? Give it the armor protection of a cruiser, but arm it with the best weapons available to any ship, and have it remain faster than any of those lumbering behemoths of the line. The Conquest is a good example of these concepts put into a hull. Many other advanced technologies were incorporated into the design, including weapon mounts designed for a circling engagement. This maneuver requires greater navigational skill while serving to provide more tactical options to the commanding officers. 

Fortune favors the bold, the ancients said. This class of ships does indeed favor the bold captain, willing to risk everything for the thrill of victory.",,,,
paragon,SHIP,"The pinnacle of the Domain's battleship designs, though perhaps less the result of military necessity and more of the ambitions of certain senior strategic staff of the Domain Navy - with considerable backing from the Tri-Tachyon corporation, among other major contractors.

No ship can outlast or outgun the Paragon-class, a true Leviathan of a bygone epoch.",,,,
odyssey,SHIP,"The asymmetric, spheroid design belies the power of this battlecruiser. The base hull presents a loadout which favors heavy energy weapons and mobility-focus. A two-wing hangar capacity complements tactical options.

The Odyssey was considered a boondoggle of a design by the Domain Naval Procurement Committee with numerous objections raised: no single tactical focus, the officer boardrooms are too large, the energy grid uses only premium components, and the fittings are too expensive. Despite several rounds of eye-watering budget overruns and rumblings of a bribery scandal, the production contract was only denied before final prototype trials. Never keen to pass up a profitable opportunity, Altair Exotech licensed the Odyssey class to several frontier development corporations, including Eridani-Utopia, to provide admirably armed mobile survey headquarters and operation platforms. It is for this role in the megacorporate exploitation of the frontiers that the otherwise rare Odyssey-class found its way to the Persean Sector.",,,,
dominator,SHIP,"Ponderous and menacing, the Dominator-class is one of the most widespread system defense cruisers in Hegemony space. 

While not the most technologically advanced hull, it relies on a plethora of ballistic hardpoints to accomplish its mission, which is more often than not defending orbital installations and vital points of intra-system trade routes. A poor shield emitter which is difficult to manage and thus, rarely engaged, gives way to an almost impregnable interlocking armor belt system making the Dominator safe from most weapons. Even strike craft cannot overcome the hail of projectiles that can be launched to intercept their payloads. This hull proves that tried and true military engineering is difficult to overcome by new ideas and technologies, especially when in the hands of tough, determined crews and experienced officers.

Dependable, durable, and a constant presence in home space around civilized worlds and outposts, the Dominator is perhaps most hated and feared by pirates and law-breaking corporate agents. ",,,,
aurora,SHIP,"The Aurora-class cruiser is a technological marvel, rarely seen. Among the fastest and most maneuverable cruisers in the Sector, it is also one of the safest due to its wide shield coverage. 

One can only wonder what the Domain Navy could accomplish with a fleet of these sleek, asymmetric, and eminently effective vessels. The shields are backed up by hyper-advanced flux dissipation systems installed throughout the hull, which gives the Aurora a deep flux pool.

Most blueprints required to manufacture Aurora-class ships are closely guarded corporate secrets, but a few have also seen service in Tri-Tachyon fleets and, rarely, in the hands of enterprising mercenary captains.

Few ships can outperform the Aurora ton for ton. Its only weakness is its prohibitive cost.",,,,
apogee,SHIP,"The Apogee-class vessel is an effective mix of advanced scientific and military technologies, perfect for long-range exploration of hostile space. 

The class features an asymmetric design with a large forward section, usually outfitted with long-range tech scanners. Apogee captains are used to operating alone and tend to be an independent, self-reliant lot. 

The ship can hold its own in one-on-one engagements by smart use of its powerful shield emitter and strong engines. However, its armor rating makes it seem somewhat fragile on paper, and thus it is rarely part of big fleet actions.

The high construction costs typically mean that only affluent tech mining consortiums can afford an Apogee-class vessel that is fully outfitted for an aggressive exploratory role.",,,,
venture,SHIP,"Tough, dependable and not overly expensive, Venture-class cruisers are usually constructed by private corporations for escort duty or by small non-aligned worlds for system defense.

The Venture-class ships are perhaps the most widely used civilian cruisers in the Sector. The blueprints for the Venture are widely available and can often be secured without too much trouble. 

When used by small corporations, the ship is usually the pride of the fleet and is used to underpin vital operations. Due to its ubiquity, the vessel also serves with quite a few pirate outfits, where it sometimes fills the role of command ship.","Tough and dependable, the Venture is usually fitted with a good missile complement but lacks the sustained damage output needed to do well in prolonged engagements. A built-in mining drone bay provides additional defenses - a particularly good thing because the civilian-grade power generators make the shields easy to overwhelm.",,,
eagle,SHIP,"Eagle-class cruisers are often found at the core of military fleets headed for battle. It is not hard to see why: A strong overall profile, with a robust engine, the Eagle's deadly weapons package is a threat to all enemies.

The Eagle can deliver a strong tactical punch to enemy formations. Its numerous turret and hardpoint emplacements make it very dangerous to smaller foes. Decent armor and a strong shield emitter let it hold space while outnumbered, or even when faced with the rare larger ship. 

These strengths are somewhat countered by strike craft - an Eagle captain must always watch their scopes for an approaching strike squadron, since their ship will be easily crippled by multiple hits from modern strike weapons. 

The embodiment of the sleek and powerful space cruiser from the time of the Domain, the Eagle-class ships are a beautiful reminder of the technological and aesthetic achievements of humanity's past. ","Agile for a cruiser, the Eagle is difficult to flank and has impressive and focused frontal firepower.",,,
falcon,SHIP,"Often called the Eagle cruiser's little brother, the Falcon-class cruiser sacrifices armor for speed, neatly filling the light cruiser role in military fleets throughout the Sector. 

The ""light"" designation does not indicate a significant reduction in firepower, however, making the Falcon a valuable tactical asset to any fleet. The ship is easily able to fill a wide variety of roles, from close support to assault, given the proper configuration. 

The Falcon's top notch engines give it the ability to quickly disengage from battle should its defenses be pressed to a critical point.

Swift and elegant, Falcon-class cruisers are often found as lead elements in larger fleet formations, or deployed to reinforce anti-pirate convoys.","This light cruiser features mobility that puts smaller ships to shame, but its firepower is somewhat lacking. However, the Falcon can still face down smaller ships due to its cruiser-grade power generators and armor plating.",,,
medusa,SHIP,"A fearsome ship whose top tier engines provide great speed and maneuverability for a destroyer. Multiple energy weapon slots allow for a plethora of tactical possibilities. Its best-in-class performance is matched by a demanding logistical profile that has led some fleet commanders to eschew its use in favor of other ships that can be deployed more frequently and cheaply.

The Medusa is one of the most respected destroyers in the sector due to its association with black ops and elite pirates. The few that have been aboard a Medusa can attest to its extreme level of technological sophistication. Medusa-class blueprints are few in number and are some of the rarest and most closely guarded data in the Sector.

Deemed too expensive to mass produce by most corporations and governments, it is rarely employed by the lawful authorities as a black ops cruiser. On the rarest occasion, a Medusa-class hull may fall into the hands of pirates. The usual results are a drastic reduction in system small to medium shipping, which puts a strain on most planetary and outpost economies.

Sector naval tacticians have few answers for the threat that the Medusa presents.",,,,
shrike,SHIP,"An advanced fast-attack light destroyer from the same design team as the near-ubiquitous Wolf, the Shrike's advanced propulsion system is designed to selectively vent plasma in a 'microburn' maneuver. This allows the Shrike to dart into tactical opportunities as they arise, strike, and escape before a proper counter-attack is mounted. Shields, armour, and sustained flux capacity are somewhat underwhelming due to the need to build a light yet economical hull which prioritizes attack speed, leading to the Shrike gaining the reputation as a glass cannon best entrusted to skilled captains.

Certain unique structural elements in the plasma venting system are known to, with wear, corrode in oxygen-rich atmospheres, so care must be taken to re-apply ceramopolymer coating at each hull servicing.",,,,
mule,SHIP,"The Mule is a rugged and reliable combat-capable freighter which built its reputation on the sparsely-patrolled frontiers of the Domain. Post-collapse, the Mule's appeal only grown through the cycles of chaos which wrack the Persean Sector and elevate the importance of strong armor and powerful weapons to otherwise thrifty traders, scavengers, and prospectors.

The original design officially designated its medium turret mount as a 'gimbaled mining utility attachment point', and even Domain operators from time past knew to read between the lines: without an escort, the Mule-class packs enough of a kick to make pirates think twice before attacking. Of course this also means that the Mule has become the ideal vehicle for a down-on-its-luck or merely opportunistic civilian crew to themselves turn pirate.",,,,
buffalo2,SHIP,"A derived class, based on the Buffalo freighter. The modifications include the addition of military grade power generators, heavier armor, and maneuvering thrusters as well as the removal of the Mk. I shield emitter and the majority of the cargo holds.

The Sector is violent and unpredictable, and conflicts often flare up over the smallest resource or perceived slight. In such situations military-grade ships are sometimes not available quickly enough. Thus, resourceful engineers turn to hull modifications in order to be able to meet the demand for war materiel.

The base hull of this destroyer is a standard Buffalo-class freighter, however due to the scope of the hull conversion, the Buffalo Mk. II is considered a separate class. The result is a fighting ship which can hold its own and fight back hard, especially if properly screened from strikes and heavier hulls. The unorthodox weapons configuration often leads to unique fleet formations, and hull modifications often mean that no two Buffalo Mk. IIs are quite the same.

The tactics employed by a Buffalo Mk. II captain will vary as much as his hull configuration, but rarely involve standing toe-to-toe with anything heavier than a frigate due to the lack of a shield generator and energy weapon emplacements. The combat plans usually involve a one hit wonder stratagem that never works on the same enemy twice, which is perfectly fine with the crew of the Buffalo Mk. II.",,,,
valkyrie,SHIP,"The Valkyrie is a standard destroyer-sized troop transport with enough room to carry two companies of marines. Tactically it is weak for its size, only able to defend itself at short ranges from missiles and fighters.

As an atmosphere-capable combat dropship with ground support weapon mounts designed to operate during re-entry and when grounded, the Valkyrie is often used to deploy heavy infantry support for tech raids on decivilized worlds. 

The ability to deliver large amounts of troops directly to ground targets while providing fire support prompted Hegemony bureaucrats to designate the hull as ""restricted"" for sale to third parties. Naturally, news of the restriction made it to the general public cycles before it came into effect, launching ill-fated speculation in the future prices of this class. Thus, overproduction and the hull's limited options made the speculator's activities bets largely moot, the only net result is that now, due to oversupply, it is just as easy to obtain a Valkyrie ship as before news of the Hegemony ban ever became public.",,,,
tarsus,SHIP,"Tarsus-class ships are well known as perhaps the most flexible and durable freighters in the Sector. 

The secret to their reliability is that they were intended by Domain designers as hazard duty ships, presumably to supply frontiers and those front line fleets send to quash the ever-present rumbling of insurrection on the far reaches of the Domain.

Almost unmatched among civilian ships in bulkhead structural density and armor rating, Tarsus-class freighters are entrusted with important hauls and usually travel in convoys, a further buttress to the safety they afford to their crew and cargo.

Minimal weapon mounts permit the ship to mount a nominal PD weapons package. Rarely, Tarsus-class ships are outfitted with combat oriented hull or armor boosting modifications, which make them more difficult to maintain.",,,,
gemini,SHIP,"A common freighter, found in convoys or alone, used to haul all manner of goods across the Sector. Has a single fighter bay to bolster defenses.

The design of the Gemini-class freighter is highly modular, enabling the ship to serve in a variety of roles in and out of combat. The entire cargo container is designed around a quick release mechanism which enables the main hull of the ship to quickly call to port, detach its full cargo section, and swap it for another Gemini-type container in the span of minutes. In addition, multiple medium weapon mounts make the Gemini a viable long-range fire support platform. The flight deck is tiny, and was original envisioned for mining drone repair or hazardous mining operations. Modern use in the Sector extends flight deck facilities to all fighter types.

While impressive in a blueprint, the lack of empty, compatible Gemini-type containers in the Sector makes the actual usefulness of the quick-release mechanism negligible. The modularity, a great boon in times past is also more prone to wear and tear, and is thus more expensive to maintain - most working examples of the mechanisms have been welded solid. Nonetheless, a decent overall profile, the flight deck, a flexible power core and good shields make the Gemini a good choice for cargo hauling, if the cost can be weathered.",,,,
shuttlepod,SHIP,"A tiny, nimble personnel-transfer shuttle just sufficient to transport the senior bridge officers of any ship in the Sector.",,,,
buffalo,SHIP,"The go-to choice for medium cargo hauling in the Sector, the Buffalo-class freighter exemplifies the ""Load-n-Pray"" principle prevalent in Sector shipping.

Sporting just a single small weapon emplacement, the hull of the ship is no more than a large engine with a tiny crew quarters section and cargo grapplers. A captain taking this ship out without a convoy rarely gets to make the same mistake twice. Incapable of anything resembling a combat maneuver, the lateral thrusters on Buffalo-class ships are designed to merely enable it to dock when (and if) it reaches its destination.

The ship engines are the greatest contributor to hull cost, which, while low, is still within the norms for a medium freighter. The greatest contributing factor to its ubiquity is the fact that the blueprint for this ship is usually hardcoded into every orbital shipyard's blueprint database.",,,,
enforcer,SHIP,"The Enforcer-class ships commonly serve in system or convoy defense roles. The design features good armor and multiple ballistic hardpoints, while shield performance is somewhat underwhelming. 

The blueprints of the ship call for many components similar to those found in the Onslaught-class battleships, suggesting that the designs were created during a similar period of military expansion in the Domain. The Enforcer-class features similar no-nonsense weapon system design choices, tough bulkheads, and is well regarded by its crews.

Tough to beat in a destroyer to destroyer fight, the Enforcer rarely takes part in larger battles due to the common view that its low speed makes it a liability. Nonetheless, Hegemony order of battle doctrines mandate an attached Enforcer squadron as a screen for Onslaught-class battleships. The logistical ease with which shared components can be used by both ship types is exactly the type of detail that excites Hegemony Logisticarum bureaucrats.",,,,
condor,SHIP,"The Condor-class sees heavy service in the Sector as this carrier-converted freighter is, for many independent polities, the easiest way to procure fighter capability for their organization. Even with limited flight deck space, the Condor gets the job done, relying on its tough armor, excellent bulkhead strength, and a respectable (for a light carrier) weapons package.

This light carrier design is derived from Tarsus-class freighters modified by desperate scavengers and pirates. The conversion process was once an involved and complex affair requiring space dock facilities, but nowadays any hull-capable forge that will accept a stock Tarsus spec will, with the addition of a custom modchip, get you something just as good.

Some in the Sector argue that even the Domain, with all their technological know-how, relied on similar conversions to make more efficient use of a merchant fleet during times of escalated hostilities on the voluminous galactic frontier. Others point out that it is unclear how ubiquitous this approach was - there could have been fleets of Condors roaming Domain space, but there is scarce hard evidence one way or the other. Such data was all lost in the Collapse.",,,,
sunder,SHIP,A technologically advanced yet fragile destroyer from the late Domain era designed to provide additional firepower in fleet actions carried out by the stretched Domain Navy rather than serve on independent patrols. It has powerful shield emitters and energy weapons but is vulnerable to strike craft and flanking assault frigates.,,,,
hammerhead,SHIP,"A midline destroyer from the golden age of the Domain, the Hammerhead is respected for its staying power in battle as well as its ballistic capabilities.",,,,
phaeton,SHIP,"A medium tanker with enough fuel capacity to support a larger fleet. Tanker duty is often considered punitive in the Hegemony - there's little opportunity for distinction, and less chance of survival should direct contact with the enemy occur.",,,,
crig,SHIP,"Originally designed to assist in assembling large ships and orbital installations, the salvage rig's gantry and manipulators are used to assist in recovering derelict hulks and scavenging useful material from wreckage and debris fields. The rig itself has no cargo or fuel capacity and requires ample supply to maintain. Increases non-combat salvage gained, with more difficult operations being able to make use of more rigs.",,,,
prometheus,SHIP,"A tanker of vast capacity used to shift strategic quantities of fuel between worlds. Unlike its smaller cousins, the Prometheus features a reasonable defensive arsenal to protect its valuable and volatile cargo.",,,,
monitor,SHIP,"An oddity among ships, the Monitor is the result of the line of thought that sometimes the best defense is indeed the best defense. Features turret mounts angled to provide wide arcs and a unique flux shunt modification to its power systems specially constructed to relieve flux generated by shields. Indeed, the Monitor makes up for a lack of maneuverability and firepower with the ability to withstand prolonged bombardment from enemy ordnance.

Though its experimental nature is perhaps a sign of the innovation that eras of turmoil seem to inspire, whether the Monitors radical defensive focus is a boon or pitfall remains contentious. Several dramatic failures in convoy protection patrols were explained by Ko Combine PR representatives to be the fault of improper tactics employed by convoy commanders. Ko Combine maintains that when positioned correctly in a combat situation and supported by strike-craft - as the anvil and hammer, respectively - simulations demonstrate that the Monitor significantly enhances convoy survivability against the average pirate attack. Prominent critics remain.",,,,
cerberus,SHIP,"The Cerberus is prized for providing a cost-effective balance between cargo capacity and enough combat power for its size to discourage casual piracy with the happy result of lowered insurance rates compared to standard Domain-era civilian grade freighters. The Cerberus is now widely considered to be a wise choice for independent traders in the Sector. 

In times past, before the fall of the gate system when Domain authority reigned, combat-enabled freighters like the Cerberus found only niche use on the edges of the rare warzone or in especially uncivilized hinterlands of the galaxy where Domain Armada patrols were stretched thinly. The crew combat training, weapon maintenance, and mass/thrust ratio loss caused by heavier armour were viewed as causing unnecessary cost overhead. But this is a new age filled with both danger and profitable opportunities; the abilities of the Cerberus have given the hull a new life in the trade lanes.",,,,
heron,SHIP,"The Heron provides the strategic and tactical mobility of a cruiser with potential firepower limited only by available strike-craft. It is the perfect accompaniment to the quick-moving and hard-hitting fleet of an admiral who knows when to take the initiative, hit quickly, and withdraw while enemy forces are still responding to the threat.

Historically the Heron represented a movement in Domain Armada strategy from a heavy capital ship doctrine based on overwhelming firepower toward a focus on strike craft and support cruisers that enable sufficient firepower to be quickly focused on weak points, a strategic shift that would reverse itself as a natural reaction against tradition from each successive generation of Armada officers. This process was occurring once more in the cycles immediately preceding the fall of the gate system and, in something of a coup for the so-called Cruiser School, the forward-thinking Altair Exotech won the Heron design contract over the traditional manufacturer of heavy Armada warships, Orion Shipyards. 

However the doctrinal shift embodied by the Heron was interrupted by the isolation of The Fall, and as such it is not often found in core Hegemony fleets (whose officers still cling to tradition). This hull has however found great popularity among the independent worlds, megacorporations, and mercenary forces of the Sector that tend to field leaner, faster fleets.",,,,
drover,SHIP,"The Drover is a hull designed by the Cruiser-school-dominated Domain Naval Procurement Committee to provide a strategically versatile (though tactically limited) fighter platform with low logistical overhead. The fighter complement of the Drover is unmatched for its size. Command of a Drover is considered something of a test of character for junior officers: Will they use fearsome alpha-strike potential to seize victory in a sudden attack or hold back and use its threat to curtail aggressive moves by the opposition?

The contract for design of the Drover was won by Orion Shipyards, the traditional Armada ship-builder, in an effort to recover lost market share from the newer naval producers. The result was the 'flying landing strip' maligned by Domain officers as a command more fitting for a logistics bureaucrat than a fighting ship-captain. Complaints in the lower ranks were used by the old Capital-school faction to send the Drover back to committee, citing insufficient firepower for the ship class to meet standard guidelines (which did not account for the strike potential of new classes of fighters). Set up to take the fall for a massive overspend, the committee simply ordered an enormous number of simple missile hardpoints installed- this met the firepower requirements handily and allowed the Drover programme to proceed with only minor alteration.",,,,
