event_type,event_stage,p,target_rel,channels,subject,summary,assessment,image,icon,tags,sound_id,implementation notes
market_procurement,accept_bonus,,,secure_comm,Accepted: acquire $quantity unit(s) of $commodity and deliver to $market,"Acquire $quantity units of $commodity and deliver to $market.

Contact $contactDesc $contactName at $market to complete the delivery.","$daysLeft to complete the delivery.

$rewardCredits reward ($perUnit per unit).

$bonusCredits bonus if delivered within $bonusDays.

$market is controlled by $marketFaction authorities.

$contactName $contactDetail.",,,"no_system_prefix, important",,
market_procurement,success,,,player_intel_always,Completed: $quantity unit(s) of $commodity delivered to $market,Mission completed successfully.,$actualReward gained.,,,"no_system_prefix, important",,
market_procurement,success_bonus,,,player_intel_always,Completed: $quantity unit(s) of $commodity delivered to $market,Mission completed successfully.,"$actualReward gained, including $bonusCredits bonus.",,,"no_system_prefix, important",,
market_procurement,failure,,,player_intel_always,Failed: failed to deliver $quantity unit(s) of $commodity to $market in time,Mission failed - deadline not met.,,,,"no_system_prefix, important",,
,,,,,,,,,,,,
# analyze entity mission,,,,,,,,,,,,
analyze_entity,posting,,,posting,Run provided sensor package on $entityName in $systemName within $daysLeft for $rewardCredits payment.,Mission will be considered completed and payment posted immediately upon running the sensor package.,$locationHint,,,no_system_prefix,,
analyze_entity,accept,,,secure_comm,Accepted: run sensor package on $entityName in $systemName,"$rewardCredits reward, must be completed within $daysLeft.

Mission will be considered completed and payment posted immediately upon running the sensor package.",$locationHint,,,"no_system_prefix, important",,
analyze_entity,failure,,,player_intel_always,Failed: run sensor package on $entityName in $systemName,Mission failed - deadline not met.,,,,"no_system_prefix, important",,
analyze_entity,success,,,player_intel_always,Completed: run sensor package on $entityName in $systemName,Mission completed successfully.,$rewardCredits gained.,,,"no_system_prefix, important",,
,,,,,,,,,,,,
# survey planet mission,,,,,,,,,,,,
survey_planet,posting,,,posting,Run a full survey on $planetName in $systemName within $daysLeft for $rewardCredits payment.,Mission will be considered completed and payment posted immediately upon survey completion.,$surveyInfo,,,no_system_prefix,,
survey_planet,accept,,,secure_comm,Accepted: run a full survey on $planetName in $systemName,"$rewardCredits reward, must be completed within $daysLeft.

Mission will be considered completed and payment posted immediately upon survey completion.",$surveyInfo,,,"no_system_prefix, important",,
survey_planet,failure,,,player_intel_always,Failed: run a full survey on $planetName in $systemName,Mission failed - deadline not met.,,,,"no_system_prefix, important",,
survey_planet,success,,,player_intel_always,Completed: run a full survey on $planetName in $systemName,Mission completed successfully.,$rewardCredits gained.,,,"no_system_prefix, important",,
,,,,,,,,,,,,
# tutorial mission,,,,,,,,,,,,
tutorial_mission,start,,,secure_comm,Secure communication from Ancyra,"You receive a tight-beam communication from the system's main inhabited world, Ancyra.

The message is brief and asks you to travel there and contact $mainContactPost $mainContactName as soon as possible.",,,,"no_system_prefix, important",,
tutorial_mission,sneak_start,,,player_intel_always,Acquire jump-point data at Derinkuyu,"Contact $dataContactName at Derinkuyu Mining Station to acquire the raw jump-point readings.

Contact must be made with the transponder off as the miners of Derinkuyu have turned pirate and your fleet will be attacked otherwise.","Use ""Go Dark"" to avoid detection, and ""Emergency Burn"" to get away if you are seen.",,,"no_system_prefix, important",,
tutorial_mission,sneak_end,,,player_intel_always,Return to Ancyra with the data,Return to Ancyra and contact $mainContactPost $mainContactLastName to deliver the jump-point data.,,,,"no_system_prefix, important",,
tutorial_mission,salvage_core_start,,,player_intel_always,Salvage an AI core from a derelict,"Analyzing the jump-point data requires an AI Core.

There's a Domain-era survey probe outside the orbit of Pontus. If salvaged, it's likely to yield a gamma AI core, which should be sufficient for the task.","Go to Pontus, head out towards the asteroid belt, and then use an Active Sensor Burst to locate the probe. 

Approach and salvage it, or pound it into scrap and scavenge through the resulting debris field.

It's likely that you will have to overcome some automated defenses first.",,,"no_system_prefix, important",,
tutorial_mission,salvage_core_end,,,player_intel_always,Return to Ancyra with the AI core,Return to Ancyra and contact $mainContactPost $mainContactLastName to deliver the AI core.,,,,"no_system_prefix, important",,
tutorial_mission,ship_recovery_start,,,player_intel_always,Recover derelict ships around Tetra,"Go to the ship graveyard around Tetra and recover as many ships as possible.

Bring extra crew to man the recovered ships, and extra supplies to help restore their combat readiness.",,,,"no_system_prefix, important",,
tutorial_mission,ship_recovery_end,,,player_intel_always,Return to Ancyra and outfit the recovered ships,Return to $mainContactPost $mainContactLastName at Ancyra for help with outfitting the recovered ships with weapons.,,,,"no_system_prefix, important",,
tutorial_mission,stabilize_jump_point,,,player_intel_always,Stabilize the inner-system jump-point,"Use the hyperwave sequence produced by the AI core to stabilize the inner-system jump-point.

You will have to defeat the pirates guarding it first.",,,,"no_system_prefix, important",,
tutorial_mission,stabilize_jump_point_done,,,player_intel_always,Return to Ancyra and report your success,"Galatia's connection with hyperspace has been restored, and trade fleets are once again able to enter and leave the system.

The Derinkuyu leadership will surely soon be toppled by rank-and-file miners eager to get on the right side of the law once again.",,,,"no_system_prefix, important",,
tutorial_mission,deliver_message,,,player_intel_always,Deliver report to Jangala in the Corvus system,"$MainContactRank $mainContactLastName has tasked you with delivering a report detailing the recent events to the $jangalaContactPost $jangalaContactLastName at Jangala.

Make sure you have enough fuel to make the trip successfully.",,,,"no_system_prefix, important",,
tutorial_mission,end,,,player_intel_always,Report delivered,You have delivered the report and your standing with the Hegemony has increased substantially.,,,,"no_system_prefix, important",,
,,,,,,,,,,,,
# faction commission,,,,,,,,,,,,
faction_commission,posting,,,posting,"Required for most military market purchases, and pays a small bounty on enemies of the faction, which will become hostile to the holder of the commission.","Bounty starts at $baseBounty credits for an enemy frigate and goes up for larger ships.

Will be annulled if the commission holder's reputation with $theFaction drops below neutral.",,,,important,,
faction_commission,accept,,,secure_comm,$Faction commission accepted,"Required for most military market purchases, and pays a small bounty on enemies of the faction, which will become hostile to the holder of the commission.","Bounty starts at $baseBounty credits for an enemy frigate and goes up for larger ships.

Will be annulled if the commission holder's reputation with $theFaction drops below neutral.
",,,important,,
faction_commission,become_hostile,,,secure_comm,$otherFaction is now hostile,"Due to your accepting a commission with $theFaction, $theOtherFactionLong is now hostile towards you.",,,,"important, nomap",,
faction_commission,bounty_payment,,,secure_comm,Payment from $theFaction: $bountyCredits credits,"The message has an encrypted attachment that contains a payment of $bountyCredits credits for fighting enemies of $theFaction.

It references flight log data from your recent battle against $enemyDesc.",$bountyCredits credits gained.,,graphics/icons/intel/gain_credits.png,nomap,,
faction_commission,annul,,,secure_comm,Commision with $theFaction annulled,The message is an official communique from $theFaction which annuls your commission due to a lack of good standing.,May accept another commission when standing improves.,,,"important, nomap",,
faction_commission,rep_drop_hostile,,,secure_comm,$Faction notice re: hostilies with $theOtherFaction,"The message is an offical communique from $theFaction, questioning your alleged hostilities with $theOtherFaction, and reminding you, in strong terms, that $theOtherFaction $otherFactionIsOrAre not an enemy of $theFaction.",Your actions may cause open hostilities between $theFaction and $theOtherFaction.,,,nomap,,
,,,,,,,,,,,,
# faction hostility,,,,,,,,,,,,
faction_hostility,warning,,,secure_comm,Impending hostilities between $theOneFaction and $theTwoFaction,You receive a warning from $theCommissionFaction that the general state of cold war with $theOtherFaction is all but certain to give way to open hostilities in a matter of weeks at the most.,"$TheOtherFaction will become hostile to you, as you hold a $commissionFaction commission.

Your standing with $theOtherFaction will be mostly restored after hostilities conclude.",,graphics/icons/intel/faction_conflict.png,important,,
faction_hostility,start,,,news,Open hostilities between $theOneFaction and $theTwoFaction,"The general state of cold war between $theOneFaction and $theTwoFaction has given way to open hostilities.

However, major fleet actions or attacks on population centers are not expected, and most experts predict that some sort of peace agreement will be made within a cycle.",,,graphics/icons/intel/faction_conflict.png,important,,
faction_hostility,end,,,news,Armistice between $theOneFaction and $theTwoFaction,"An accord has been reached through back channels, open hostilities between $theOneFaction and $theTwoFaction have ceased, and normal trade has resumed.",Open hostilities are over.,,graphics/icons/intel/faction_peace.png,important,,
,,,,,,,,,,,,
# civil disorder,,,,,,,,,,,,
civil_disorder,possible1,,,player_intel,Possible civil disorder $onOrAt $market,There are indicators that civil disorder is likely to occur $onOrAt $market within a few weeks.,Decreased production $onOrAt $market.,,,,,
civil_disorder,possible2,,,news,Possible civil disorder $onOrAt $market,A prominent intellectual $onOrAt $market released a statement critical of $rulingfaction and was arrested shortly thereafter. $rulingfaction officials have made no comment.,Increased signs of civil disorder $onOrAt $market.,,,,,
civil_disorder,possible3,,,news,Possible civil disorder $onOrAt $market,"A protest was held outside local $rulingFaction administration headquarters $onOrAt $market. The crowd was dispersed by authorities, resulting in several deaths.",Increased signs of civil disorder $onOrAt $market.,,,,,various factions may comment on this event
civil_disorder,possible3,,HOSTILE,"tritachyon_public,
hegemony_public",Possible civil disorder $onOrAt $market,$faction has released a statement condemning the unnecessarily harsh $rulingFaction crackdown on protests $onOrAt $market.,Increased signs of civil disorder $onOrAt $market.,,,,,possible reaction to the above event
civil_disorder,possible3,,FRIENDLY,"tritachyon_public,
hegemony_public",Possible civil disorder $onOrAt $market,"$faction has released a statement condemning the protests taking place $onOrAt $market, urging their leaders to turn themselves in to $rulingFaction officials.",Increased signs of civil disorder $onOrAt $market.,,,,,possible reaction to the above event
civil_disorder,possible4,,,news,Possible civil disorder $onOrAt $market,Local $rulingfaction authorities $onOrAt $market have announced that several prominent anti-government agitators have been arrested.,Increased signs of civil disorder $onOrAt $market.,,,,,
civil_disorder,likely,,,player_intel,Likely civil disorder $onOrAt $market,There are indicators that civil disorder is all but certain to occur $onOrAt $market within a few weeks.,Decreased production $onOrAt $market.,,,,,
civil_disorder,start1,,,news,Civil disorder $onOrAt $market,A general strike has broken out $onOrAt $market. $rulingfaction officials have released a statement condemning the actions of a few anti-government ringleaders. ,Decreased production $onOrAt $market.,,,,,
civil_disorder,start2,,,news,Civil disorder $onOrAt $market,A series of bombings targeting $rulingparty facilities $onOrAt $market has taken place. An official statement was made promising that the perpetrators would be brought to justice.,Decreased production $onOrAt $market.,,,,,
civil_disorder,start3,,,news,Civil disorder $onOrAt $market,Acts of sabotage have brought major production centers $onOrAt $market to a standstill.,Decreased production $onOrAt $market.,,,,,
civil_disorder,ending1,,,news,,Martial law has been declared $onOrAt $market to suppress civil disorder.,Production will likely soon return to normal levels.,,,,,
civil_disorder,ending2,,,news,,$rulingfaction officials $onOrAt $market have announced raids on several opposition safehouses. The resulting shootout led to scores of casualties.,Production will likely soon return to normal levels.,,,,,
civil_disorder,ending3,,,news,,Marines have been deployed to major population centers $onOrAt $market to quell the civil disorder.,Production will likely soon return to normal levels.,,,,,
civil_disorder,ending4,,,news,,Talks have opened between $rulingFaction and opposition leaders $onOrAt $market.,Production will likely soon return to normal levels.,,,,,
civil_disorder,end1,,,news,,Martial law has been lifted as peace returns to $market.,Production is back to normal levels.,,,,,
civil_disorder,end2,,,news,,Marines have been withdrawn from major population centers as peace returns to $market.,Production is back to normal levels.,,,,,
,,,,,,,,,,,,
,,,,,,,,,,,,
sindria_terrorists,likely,,,sindrian_diktat_internal,Possible terrorist attacks on Sindria,Intelligence indicates that terrorists have obtained a cache of illegal weapons and intend to use them against government targets.,Likely decreased production on Sindria.,,,,,precursor to terrorist attacks
sindria_terrorists,start1,,,news,Terrorist attacks on Sindria,A public monument commemorating the Lion's military victories was destroyed in a midnight bombing that was swiftly condemned by Diktat officials. A temporary curfew has been imposed in the major hive-cities and security patrols increased.,Decreased production on Sindria.,,,,,start option 1
sindria_terrorists,start2,,,news,Terrorist attacks on Sindria,Several bombs were found and defused in key Sindrian industrial centers. Facilities all over the planet have been shut down and searched for bombs. A Diktat official announced the assembly of a special taskforce to find the perpetrators.,Decreased production on Sindria.,,,,,start option 2
sindria_terrorists,start3,,,news,Terrorist attacks on Sindria,A series of bombings targeting Diktat administration offices has taken place on Sindria. A statement released by Diktat officials promised that the terrorists would be brought swift justice.,Decreased production on Sindria.,,,,,start option 3
sindria_terrorists,continued1,,,news,Terrorist attacks on Sindria,Several explosions rocked the upper levels of major hive cities; terrorist leaders have released a holovid statement saying that the bombings will continue until certain political prisoners held on Cruor are released by Diktat authorities. ,Decreased production on Sindria.,,,,,"may proceed through zero or more of the ""continued"" event stages before reaching one of the concluding stages."
sindria_terrorists,continued2,,,news,Terrorist attacks on Sindria,"Terrorist gunmen stormed a Diktat naval recruitment center today. All were killed in a firefight that raged for hours, leading to scores of civilian casualties. Diktat officials have condemned the cowardly act.",Decreased production on Sindria.,,,,,""""
sindria_terrorists,concluding1,,,news,Terrorist attacks ending on Sindria,A terrorist safehouse was stormed by security forces but found abandoned. Diktat Intelligence officials claim that they have found evidence which will help track down the terrorists.,Production on Sindria will soon return to normal levels.,,,,,
sindria_terrorists,concluding2,,,news,Terrorist attacks ending on Sindria,A terrorist henchman was captured and interrogated by Diktat intelligence. Officials state that the hunt for the terrorist leaders is nearing an end.,Production on Sindria will soon return to normal levels.,,,,,
sindria_terrorists,end1,,,news,Terrorist attacks on Sindria stopped.,"Several terrorist safehouses were raided by Diktat security forces in a sudden early morning operation. Improperly stored munitions detonated, say officials, leaving no survivors.",Production levels return to normal on Sindria.,,,,,
sindria_terrorists,end2,,,news,Terrorist attacks on Sindria stopped.,Diktat security forces have captured terrorist leaders attempting to flee Sindria. Officials have stated that after they are intergated by Diktat Intelligence there will be a swift trial and public execution.,Production levels return to normal on Sindria.,,,,,"Like a Cardassian novel, everyone arrested in Sindria is guilty - the only question remains: of what?"